DFSE,Dimensional Emerging Markets Sustainability Core 1 ETF,TXN11-7,N,Tape B
DFSI,Dimensional International Sustainability Core 1 ETF,TXN11-4,N,Tape B
DFSU,Dimensional US Sustainability Core 1 ETF,TXN11-1,N,Tape B
DFSV,Dimensional US Small Cap Value ETF,TXN11-3,N,Tape B
DFUS,Dimensional U.S. Equity Market ETF,TXN12-7,N,Tape B
DFUV,Dimensional US Marketwide Value ETF,TXN11-7,N,Tape B
DFVE,DoubleLine Fortune 500 Equal Weight ETF,TXN10-1,N,Tape B
DFVX,Dimensional US Large Cap Vector ETF,TXN10-7,N,Tape B
DG,Dollar General Corp.,TXN5-4,Y,Tape A
DGCB,Dimensional Global Credit ETF,TXN13-7,N,Tape C
DGHI,Digihost Technology Inc. Subordinate Voting Shares,TXN14-7,N,Tape C
DGICA,Donegal Group Inc,TXN13-2,N,Tape C
DGICB,Donegal Group Inc,TXN13-4,N,Tape C
DGII,Digi International Inc,TXN13-3,N,Tape C
DGIN,VanEck Digital India ETF,TXN10-7,N,Tape B
DGLY,"Digital Ally, Inc. Common Stock",TXN13-3,N,Tape C
DGP,"DB Gold Double Long ETN due February 15, 2038",TXN10-5,N,Tape B
DGRE,WisdomTree Trust WisdomTree Emerging Markets Quality Dividend Growth Fund,TXN13-2,N,Tape C
DGRO,iShares Core Dividend Growth ETF,TXN11-3,N,Tape B
DGRS,WisdomTree Trust WisdomTree U.S. SmallCap Quality Dividend Growth Fund,TXN13-5,N,Tape C
DGRW,WisdomTree Trust WisdomTree U.S. Quality Dividend Growth Fund,TXN13-3,N,Tape C
DGS,WisdomTree Emerging Markets SmallCap Dividend Fund,TXN12-6,N,Tape B
DGT,SPDR Global Dow ETF (based on The Global Dow),TXN12-8,N,Tape B
DGX,Quest Diagnostics Inc.,TXN6-4,Y,Tape A
DGZ,"DB Gold Short ETN due February 15, 2038",TXN10-3,N,Tape B
DH,Definitive Healthcare Corp. Class A Common Stock,TXN13-1,N,Tape C
DHAI,"DIH Holdings US, Inc. Class A Common Stock",TXN13-6,N,Tape C
DHAIW,"DIH Holding US, Inc. Warrants",TXN14-8,N,Tape C
DHC,Diversified Healthcare Trust Common Shares of Beneficial Interest,TXN13-5,N,Tape C
DHCNI,Diversified Healthcare Trust 5.625% Senior Notes due 2042,TXN13-5,N,Tape C
DHCNL,Diversified Healthcare Trust 6.25% Senior Notes Due 2046,TXN14-8,N,Tape C
DHDG,FT Vest U.S. Equity Quarterly 2.5 to 15 Buffer ETF,TXN11-4,N,Tape B
DHF,BNY Mellon High Yield Strategies Fund,TXN3-8,Y,Tape A
DHI,D.R. Horton Inc.,TXN6-2,Y,Tape A
DHIL,Diamond Hill Investment Group,TXN14-2,N,Tape C
DHR,Danaher Corporation,TXN7-7,Y,Tape A
DHS,WisdomTree U.S. High Dividend Fund,TXN10-4,N,Tape B
DHT,"DHT HOLDINGS, INC.",TXN9-1,Y,Tape A
DHX,"DHI Group, Inc.",TXN1-8,Y,Tape A
DHY,Credit Suisse High Yield Bond Fund,TXN12-4,N,Tape B
DIA,SPDR Dow Jones Industrial Average ETF Trust,TXN10-4,N,Tape B
DIAL,Columbia Diversified Fixed Income Allocation ETF,TXN12-4,N,Tape B
DIAX,NUVEEN DOW 30SM DYNAMIC OVERWRITE FUND,TXN3-8,Y,Tape A
DIBS,"1stdibs.com, Inc. Common Stock",TXN13-8,N,Tape C
DIEM,Franklin Emerging Market Core Dividend Tilt Index ETF,TXN12-5,N,Tape B
DIG,ProShares Ultra Energy,TXN10-2,N,Tape B
DIHP,Dimensional International High Profitability ETF,TXN10-2,N,Tape B
DIM,WisdomTree International MidCap Dividend Fund,TXN11-1,N,Tape B
DIN,"Dine Brands Global, Inc.",TXN7-6,Y,Tape A
DINO,HF Sinclair Corporation,TXN7-5,Y,Tape A
DINT,Davis Select International ETF,TXN12-3,N,Tape B
DIOD,Diodes Inc,TXN14-5,N,Tape C
DIPS,YieldMax Short NVDA Option Income Strategy ETF,TXN12-1,N,Tape B
DIS,The Walt Disney Company,TXN5-6,Y,Tape A
DISO,YieldMax DIS Option Income Strategy ETF,TXN10-7,N,Tape B
DIST,Distoken Acquisition Corporation Ordinary Shares,TXN14-3,N,Tape C
DISTR,Distoken Acquisition Corporation Right,TXN13-3,N,Tape C
DISTW,Distoken Acquisition Corporation Warrant,TXN13-8,N,Tape C
DISV,Dimensional International Small Cap Value ETF,TXN11-5,N,Tape B
DIT,AMCON Distributing Co.,TXN11-3,N,Tape B
DIV,Global X SuperDividend U.S. ETF,TXN12-8,N,Tape B
DIVB,iShares Core Dividend ETF,TXN11-8,N,Tape B
DIVD,Altrius Global Dividend ETF,TXN14-7,N,Tape C
DIVG,Invesco S&P 500 High Dividend Growers ETF,TXN11-7,N,Tape B
DIVI,Franklin International Core Dividend Tilt Index ETF,TXN11-1,N,Tape B
DIVL,Madison Dividend Value ETF,TXN11-1,N,Tape B
DIVO,Amplify CWP Enhanced Dividend Income ETF,TXN10-2,N,Tape B
DIVP,Cullen Enhanced Equity Income ETF,TXN12-8,N,Tape B
DIVS,SmartETFs Dividend Builder ETF,TXN10-1,N,Tape B
DIVY,Sound Equity Dividend Income ETF,TXN5-8,Y,Tape A
DIVZ,Opal Dividend Income ETF,TXN11-4,N,Tape B
DJAN,FT Vest U.S. Equity Deep Buffer ETF - January,TXN12-6,N,Tape B
DJCB,"ETRACS Bloomberg Commodity Index Total Return ETN Series B due October 31, 2039",TXN11-7,N,Tape B
DJCO,Daily Journal Corp,TXN13-2,N,Tape C
DJD,Invesco Dow Jones Industrial Average Dividend ETF,TXN10-5,N,Tape B
DJIA,Global X Dow 30 Covered Call ETF,TXN11-7,N,Tape B
DJP,"iPath Bloomberg Commodity Index Total Return ETN due June 12, 2036",TXN10-7,N,Tape B
DJT,Trump Media & Technology Group Corp. Common Stock,TXN13-6,N,Tape C
DJTWW,Trump Media & Technology Group Corp. Warrants,TXN14-2,N,Tape C
DJUL,FT Vest U.S. Equity Deep Buffer ETF - July,TXN10-2,N,Tape B
DJUN,FT Vest U.S. Equity Deep Buffer ETF - June,TXN12-6,N,Tape B
DK,"Delek US Holdings, Inc.",TXN2-5,Y,Tape A
DKL,"DELEK LOGISTICS PARTNERS, LP",TXN4-8,Y,Tape A
DKNG,DraftKings Inc. Class A Common Stock,TXN13-8,N,Tape C
DKS,"Dick's Sporting Goods, Inc.",TXN2-7,Y,Tape A
DLB,"Dolby Laboratories, Inc.Class A",TXN7-8,Y,Tape A
DLHC,DLH Holdings Corp.,TXN14-5,N,Tape C
DLN,WisdomTree U.S. LargeCap Dividend Fund,TXN12-8,N,Tape B
DLNG,DYNAGAS LNG PARNERS LP,TXN7-8,Y,Tape A
DLNG PRA,"Dynagas LNG Partners LP 9.00% Series A Cumulative Redeemable Preferred Units, liquidation preference",TXN7-8,Y,Tape A
DLNG PRB,Dynagas LNG Partners LP 8.75% Series B Fixed to Floating Rate Cumulative Redeemable Perpetual Prefer,TXN3-8,Y,Tape A
DLO,DLocal Limited Class A Common Shares,TXN13-7,N,Tape C
DLPN,"Dolphin Entertainment, Inc.",TXN13-7,N,Tape C
DLR,"Digital Realty Trust, Inc.",TXN5-8,Y,Tape A
DLR PRJ,"Digital Realty Trust, Inc. 5.250% Series J Cumulative Redeemable Preferred Stock",TXN9-8,Y,Tape A
DLR PRK,"Digital Realty Trust, Inc. 5.850% Series K Cumulative Redeemable Preferred Stock, par value $0.01 pe",TXN7-8,Y,Tape A
DLR PRL,"Digital Realty Trust, Inc. 5.200% Series L Cumulative Redeemable Preferred Stock",TXN4-8,Y,Tape A
DLS,WisdomTree International SmallCap Dividend Fund,TXN11-4,N,Tape B
DLTH,Duluth Holdings Inc. Class B Common Stock,TXN14-1,N,Tape C
DLTR,Dollar Tree Inc.,TXN14-3,N,Tape C
DLX,Deluxe Corporation,TXN6-8,Y,Tape A
DLY,DoubleLine Yield Opportunities Fund,TXN2-8,Y,Tape A
DM,"Desktop Metal, Inc.",TXN4-7,Y,Tape A
DMA,Destra Multi-Alternative Fund,TXN2-8,Y,Tape A
DMAC,DiaMedica Therapeutics Inc. Common Stock,TXN14-5,N,Tape C
DMAR,FT Vest U.S. Equity Deep Buffer ETF - March,TXN10-6,N,Tape B
DMAT,Global X Disruptive Materials ETF,TXN13-6,N,Tape C
DMAY,FT Vest U.S. Equity Deep Buffer ETF - May,TXN10-4,N,Tape B
DMB,"BNY Mellon Municipal Bond Infrastructure Fund, Inc.",TXN8-8,Y,Tape A
DMBS,DoubleLine Mortgage ETF,TXN12-7,N,Tape B
DMCY,Democracy International Fund,TXN11-4,N,Tape B
DMF,BNY Mellon Municipal Income Inc.,TXN11-2,N,Tape B
DMLP,Dorchester Minerals LP,TXN14-2,N,Tape C
DMN,Damon Inc. Common Stock,TXN13-5,N,Tape C
DMO,Western Asset Mortgage Opportunity Fund Inc.,TXN8-8,Y,Tape A
DMRC,Digimarc Corporation,TXN14-2,N,Tape C
DMXF,iShares ESG Advanced MSCI EAFE ETF,TXN13-3,N,Tape C
DMYY,"dMY Squared Technology Group, Inc.",TXN11-2,N,Tape B
DMYY U,"dMY Squared Technology Group, Inc. Units, each consisting of one share of Class A common stock and o",TXN12-8,N,Tape B
DMYY WS,"dMY Squared Technology Group, Inc. Redeemable Warrants, each whole warrant exercisable for one share",TXN11-2,N,Tape B
DNA,"Ginkgo Bioworks Holdings, Inc.",TXN3-5,Y,Tape A
DNB,"Dun & Bradstreet Holdings, Inc.",TXN3-4,Y,Tape A
DNL,WisdomTree Global ex-US Quality Dividend Growth Fund,TXN12-4,N,Tape B
DNLI,Denali Therapeutics Inc. Common Stock,TXN14-7,N,Tape C
DNMR,"Danimer Scientific, Inc.",TXN6-8,Y,Tape A
DNN,Denison Mines Corp,TXN11-7,N,Tape B
DNOV,FT Vest U.S. Equity Deep Buffer ETF - November,TXN10-3,N,Tape B
DNOW,DNOW Inc.,TXN2-5,Y,Tape A
DNP,DNP Select Income Fund Inc.,TXN5-7,Y,Tape A
DNTH,"Dianthus Therapeutics, Inc. Common Stock",TXN13-6,N,Tape C
DNUT,"Krispy Kreme, Inc. Common Stock",TXN13-1,N,Tape C
DOC,"Healthpeak Properties, Inc.",TXN2-4,Y,Tape A
DOCN,"DigitalOcean Holdings, Inc.",TXN2-7,Y,Tape A
DOCS,"Doximity, Inc.",TXN8-7,Y,Tape A
DOCT,FT Vest U.S. Equity Deep Buffer ETF - October,TXN10-5,N,Tape B
DOCU,"DocuSign, Inc. Common Stock",TXN14-5,N,Tape C
DOG,ProShares Short Dow30,TXN11-5,N,Tape B
DOGG,FT Vest DJIA Dogs 10 Target Income ETF,TXN11-7,N,Tape B
DOGZ,Dogness (International) Corporation Class A Common Stock,TXN14-3,N,Tape C
DOL,WisdomTree International LargeCap Dividend Fund,TXN12-2,N,Tape B
DOLE,Dole plc,TXN8-5,Y,Tape A
DOMH,Dominari Holdings Inc. Common Stock,TXN14-5,N,Tape C
DOMO,"Domo, Inc. Class B Common Stock",TXN14-5,N,Tape C
DON,WisdomTree U.S. MidCap Dividend Fund,TXN11-3,N,Tape B
DOOO,BRP Inc. Common Subordinate Voting Shares,TXN14-3,N,Tape C
DORM,"Dorman Products, Inc. New",TXN13-1,N,Tape C
DOUG,Douglas Elliman Inc.,TXN4-4,Y,Tape A
DOV,Dover Corporation,TXN1-8,Y,Tape A
DOW,Dow Inc.,TXN8-1,Y,Tape A
DOX,Amdocs Limited,TXN13-4,N,Tape C
DOYU,DouYu International Holdings Limited ADS,TXN14-8,N,Tape C
DPG,Duff & Phelps Utility and Infrastructure Fund Inc.,TXN7-8,Y,Tape A
DPRO,Draganfly Inc. Common Shares,TXN14-1,N,Tape C
DPST,Direxion Daily Regional Banks Bull 3X Shares,TXN12-1,N,Tape B
DPZ,Domino's Pizza Inc.,TXN2-5,Y,Tape A
DQ,Daqo New Energy Corp. American Depositary Shares (each representing 5 Ordinary Shares),TXN1-4,Y,Tape A
DRAG,Roundhill China Dragons ETF,TXN10-5,N,Tape B
DRAI,Draco Evolution AI ETF,TXN12-5,N,Tape B
DRCT,"Direct Digital Holdings, Inc. Class A Common Stock",TXN14-7,N,Tape C
DRD,DRDGOLD Ltd.,TXN7-4,Y,Tape A
DRH,DiamondRock Hospitality Company,TXN9-3,Y,Tape A
DRH PRA,DiamondRock Hospitality Company 8.250% Series A Cumulative Redeemable Preferred Stock,TXN6-8,Y,Tape A
DRI,"Darden Restaurants, Inc.",TXN1-5,Y,Tape A
DRIO,DarioHealth Corp. Common Stock,TXN13-1,N,Tape C
DRIP,Direxion Daily S&P Oil & Gas Exp. & Prod. Bear 2X Shares,TXN10-4,N,Tape B
DRIV,Global X Autonomous & Electric Vehicles ETF,TXN14-3,N,Tape C
DRLL,Strive U.S. Energy ETF,TXN7-8,Y,Tape A
DRMA,"Dermata Therapeutics, Inc. Common Stock",TXN14-7,N,Tape C
DRMAW,"Dermata Therapeutics, Inc. Warrant",TXN13-4,N,Tape C
DRN,Direxion Daily Real Estate Bull 3X Shares,TXN11-8,N,Tape B
DRRX,Durect Corp,TXN13-1,N,Tape C
DRS,"Leonardo DRS, Inc. Common Stock",TXN13-5,N,Tape C
DRSK,Aptus Defined Risk ETF,TXN11-4,N,Tape B
DRTS,Alpha Tau Medical Ltd. Ordinary Shares,TXN13-7,N,Tape C
DRTSW,Alpha Tau Medical Ltd. Warrant,TXN14-2,N,Tape C
DRUG,Bright Minds Biosciences Inc. Common Stock,TXN13-7,N,Tape C
DRUP,GraniteShares Nasdaq Select Disruptors ETF,TXN12-4,N,Tape B
DRV,Direxion Daily Real Estate Bear 3X Shares,TXN10-7,N,Tape B
DRVN,Driven Brands Holdings Inc. Common Stock,TXN14-3,N,Tape C
DSCF,Discipline Fund ETF,TXN10-1,N,Tape B
DSEP,FT Vest U.S. Equity Deep Buffer ETF - September,TXN10-7,N,Tape B
DSGN,"Design Therapeutics, Inc. Common Stock",TXN14-5,N,Tape C
DSGR,"Distribution Solutions Group, Inc. Common Stock",TXN13-5,N,Tape C
DSGX,Descartes Systems Group Inc,TXN14-4,N,Tape C
DSI,iShares MSCI KLD 400 Social ETF,TXN12-8,N,Tape B
DSL,DOUBLELINE INCOME SOLUTIONS FUND,TXN8-8,Y,Tape A
DSM,"BNY Mellon Strategic Municipal Bond Fund, Inc.",TXN5-8,Y,Tape A
DSMC,Distillate Small/Mid Cash Flow ETF,TXN4-8,Y,Tape A
DSP,Viant Technology Inc. Class A Common Stock,TXN14-5,N,Tape C
DSS,"DSS, Inc.",TXN10-7,N,Tape B
DSTL,Distillate U.S. Fundamental Stability & Value ETF,TXN12-1,N,Tape B
DSTX,Distillate International Fundamental Stability & Value ETF,TXN1-8,Y,Tape A
DSU,"Blackrock Debt Strategies Fund, Inc.",TXN4-8,Y,Tape A
DSWL,Deswell Industries Inc,TXN14-2,N,Tape C
DSX,"Diana Shipping, Inc.",TXN8-8,Y,Tape A
DSX PRB,"DIANA SHIPPING INC 8.875% Series B Cumulative Redeemable Perpetual Preferred Shares, $0.01 par value",TXN6-8,Y,Tape A
DSX WS,"Diana Shipping Inc. Warrants to Purchase Common Stock (expiring on or about December 14, 2026)",TXN9-8,Y,Tape A
DSY,Big Tree Cloud Holdings Limited Ordinary Shares,TXN14-8,N,Tape C
DSYWW,Big Tree Cloud Holdings Limited Warrants,TXN13-5,N,Tape C
DT,"Dynatrace, Inc.",TXN3-1,Y,Tape A
DTAN,Sparkline International Intangible Value ETF,TXN11-4,N,Tape B
DTB,DTE Energy Company 2020 Series G 4.375% Junior Subordinated Debentures due 2080,TXN3-8,Y,Tape A
DTC,"Solo Brands, Inc.",TXN6-8,Y,Tape A
DTCK,Davis Commodities Limited Ordinary Shares,TXN13-7,N,Tape C
DTCR,Global X Funds Global X Data Center & Digital Infrastructure ETF,TXN14-7,N,Tape C
DTD,WisdomTree U.S. Total Dividend Fund,TXN12-6,N,Tape B
DTE,DTE Energy Company,TXN1-6,Y,Tape A
DTEC,ALPS Disruptive Technologies ETF,TXN10-5,N,Tape B
DTF,DTF Tax-Free Income 2028 Term Fund Inc.,TXN6-8,Y,Tape A
DTG,DTE Energy Company 2021 Series E 4.375% Junior Subordinated Debentures,TXN9-8,Y,Tape A
DTH,WisdomTree International High Dividend  Fund,TXN12-5,N,Tape B
DTI,Drilling Tools International Corporation Common Stock,TXN14-4,N,Tape C
DTIL,"Precision BioSciences, Inc. Common Stock",TXN13-1,N,Tape C
DTM,"DT Midstream, Inc.",TXN1-5,Y,Tape A
DTRE,First Trust Alerian Disruptive Technology Real Estate ETF,TXN12-7,N,Tape B
DTSQ,DT Cloud Star Acquisition Corporation Ordinary Shares,TXN13-4,N,Tape C
DTSQR,DT Cloud Star Acquisition Corporation Right,TXN13-8,N,Tape C
DTSQU,DT Cloud Star Acquisition Corporation Units,TXN14-1,N,Tape C
DTSS,Datasea Inc. Common Stock,TXN13-7,N,Tape C
DTST,Data Storage Corporation Common Stock,TXN13-4,N,Tape C
DTSTW,Data Storage Corporation Warrant,TXN14-6,N,Tape C
DTW,DTE Energy Company 2017 Series E 5.25% Junior Subordinated Debentures due 2077,TXN4-8,Y,Tape A
DUBS,Aptus Large Cap Enhanced Yield ETF,TXN12-1,N,Tape B
DUET,DUET Acquisition Corp. Class A Common Stock,TXN14-3,N,Tape C
DUETU,DUET Acquisition Corp. Unit,TXN14-6,N,Tape C
DUETW,DUET Acquisition Corp. Warrant,TXN13-2,N,Tape C
DUG,ProShares UltraShort Energy,TXN12-5,N,Tape B
DUHP,Dimensional US High Profitability ETF,TXN10-5,N,Tape B
DUK,Duke Energy Corporation,TXN4-4,Y,Tape A
DUK PRA,"Duke Energy Corporation Depositary Shares, each representing a 1/1,000th interest in a share of 5.75",TXN8-8,Y,Tape A
DUKB,Duke Energy Corporation 5.625% Junior Subordinated Debentures due 2078,TXN2-8,Y,Tape A
DUKH,Ocean Park High Income ETF,TXN13-6,N,Tape C
DUKQ,Ocean Park Domestic ETF,TXN10-7,N,Tape B
DUKX,Ocean Park International ETF,TXN13-7,N,Tape C
DUKZ,Ocean Park Diversified Income ETF,TXN11-4,N,Tape B
DULL,MicroSectors Gold -3x Inverse Leveraged ETN,TXN11-5,N,Tape B
DUO,Fangdd Network Group Ltd. Class A Ordinary Shares,TXN14-6,N,Tape C
DUOL,"Duolingo, Inc. Class A Common Stock",TXN13-1,N,Tape C
DUOT,"Duos Technologies Group, Inc. Common Stock",TXN13-6,N,Tape C
DURA,VanEck Durable High Dividend ETF,TXN11-8,N,Tape B
DUSA,Davis Select U.S. Equity ETF,TXN11-3,N,Tape B
DUSB,Dimensional Ultrashort Fixed Income ETF,TXN10-4,N,Tape B
DUSL,Direxion Daily Industrials Bull 3X Shares,TXN10-2,N,Tape B
DUST,Direxion Daily Gold Miners Index Bear 2X Shares,TXN12-5,N,Tape B
DV,"DoubleVerify Holdings, Inc.",TXN7-2,Y,Tape A
DVA,DaVita Inc.,TXN1-4,Y,Tape A
DVAL,BrandywineGLOBAL - Dynamic US Large Cap Value ETF,TXN13-6,N,Tape C
DVAX,Dynavax Technologies Corporation,TXN14-1,N,Tape C
DVDN,Kingsbarn Dividend Opportunity ETF,TXN12-5,N,Tape B
DVLU,First Trust Dorsey Wright Momentum & Value ETF,TXN13-5,N,Tape C
DVN,Devon Energy Corporation,TXN6-5,Y,Tape A
DVND,Touchstone Dividend Select ETF,TXN12-6,N,Tape B
DVOL,First Trust Dorsey Wright Momentum & Low Volatility ETF,TXN13-1,N,Tape C
DVY,iShares Select Dividend ETF,TXN13-7,N,Tape C
DVYA,iShares Asia/Pacific Dividend ETF,TXN12-5,N,Tape B
DVYE,iShares Emerging Markets Dividend ETF,TXN11-5,N,Tape B
DWAS,Invesco Exchange-Traded Fund Trust II Invesco Dorsey Wright SmallCap Momentum ETF,TXN13-6,N,Tape C
DWAT,Arrow Investments Trust Arrow DWA Tactical ETF,TXN12-7,N,Tape B
DWAW,AdvisorShares Dorsey Wright FSM All Cap World ETF,TXN13-1,N,Tape C
DWCR,Arrow DWA Country Rotation ETF,TXN11-1,N,Tape B
DWLD,Davis Select Worldwide ETF,TXN11-6,N,Tape B
DWM,WisdomTree International Equity Fund,TXN12-5,N,Tape B
DWMF,WisdomTree International Multifactor Fund,TXN12-5,N,Tape B
DWSH,AdvisorShares Dorsey Wright Short ETF,TXN13-4,N,Tape C
DWSN,Dawson Geophysical Company New Common Stock,TXN14-8,N,Tape C
DWTX,"Dogwood Therapeutics, Inc. Common Stock",TXN14-6,N,Tape C
DWUS,AdvisorShares Dorsey Wright FSM US Core ETF,TXN13-8,N,Tape C
DWX,SPDR S&P International Dividend ETF,TXN10-7,N,Tape B
DX,"Dynex Capital, Inc.",TXN6-6,Y,Tape A
DX PRC,"Dynex Capital, Inc. 6.900% Series C Fixed-to-Floating Rate Cumulative Redeemable Preferred Stock",TXN1-8,Y,Tape A
DXC,DXC Technology Company,TXN6-8,Y,Tape A
DXCM,"DexCom, Inc.",TXN14-8,N,Tape C
DXD,ProShares UltraShort Dow 30,TXN10-3,N,Tape B
DXIV,Dimensional International Vector Equity ETF,TXN12-1,N,Tape B
DXJ,WisdomTree Japan Hedged Equity Fund,TXN12-8,N,Tape B
DXJS,WisdomTree Japan Hedged SmallCap Equity Fund,TXN14-6,N,Tape C
DXLG,"Destination XL Group, Inc. Common Stock",TXN14-5,N,Tape C
DXPE,DXP Enterprises Inc,TXN13-4,N,Tape C
DXR,Daxor Corporation Common Stock,TXN13-3,N,Tape C
DXUV,Dimensional US Vector Equity ETF,TXN11-1,N,Tape B
DXYZ,Destiny Tech100 Inc.,TXN4-5,Y,Tape A
DY,"Dycom Industries, Inc.",TXN1-8,Y,Tape A
DYAI,"Dyadic International, Inc.",TXN13-6,N,Tape C
DYCQ,DT Cloud Acquisition Corporation Ordinary Shares,TXN14-2,N,Tape C
DYCQR,DT Cloud Acquisition Corporation Right,TXN13-5,N,Tape C
DYCQU,DT Cloud Acquisition Corporation Unit,TXN13-1,N,Tape C
DYFI,IDX Dynamic Fixed Income ETF,TXN14-5,N,Tape C
DYLD,LeaderShares Dynamic Yield ETF,TXN10-2,N,Tape B
DYLG,Global X Dow 30Covered Call & Growth ETF,TXN10-5,N,Tape B
DYN,"Dyne Therapeutics, Inc. Common Stock",TXN14-6,N,Tape C
DYNF,iShares U.S. Equity Factor Rotation Active ETF,TXN12-2,N,Tape B
DYNI,IDX Dynamic Innovation ETF,TXN13-8,N,Tape C
DYNXU,Dynamix Corporation Unit,TXN14-3,N,Tape C
DYTA,SGI Dynamic Tactical ETF,TXN14-2,N,Tape C
DZZ,"DB Gold Double Short ETN due February 15, 2038",TXN11-4,N,Tape B
E,ENI S.p.A.,TXN2-3,Y,Tape A
EA,Electronic Arts Inc,TXN13-3,N,Tape C
EAD,Allspring Income Opportunities Fund,TXN12-3,N,Tape B
EAF,GrafTech International Ltd.,TXN1-3,Y,Tape A
EAFG,Pacer Developed Markets Cash Cows Growth Leaders ETF,TXN12-2,N,Tape B
EAGG,iShares ESG Aware U.S. Aggregate Bond ETF,TXN11-6,N,Tape B
EAGL,Eagle Capital Select Equity ETF,TXN11-2,N,Tape B
EAI,"Entergy Arkansas, LLC First Mortgage Bonds, 4.875% Series due September 1, 2066",TXN5-8,Y,Tape A
EALT,Innovator U.S. Equity 5 to 15 Buffer ETF - Quarterly,TXN11-1,N,Tape B
EAOA,iShares ESG Aware Aggressive Allocation ETF,TXN10-4,N,Tape B
EAOK,iShares ESG Aware Conservative Allocation ETF,TXN12-7,N,Tape B
EAOM,iShares ESG Aware Moderate Allocation ETF,TXN10-5,N,Tape B
EAOR,iShares ESG Aware Growth Allocation ETF,TXN10-5,N,Tape B
EAPR,Innovator Emerging Markets Power Buffer ETF - April,TXN11-3,N,Tape B
EARN,Ellington Credit Company,TXN2-8,Y,Tape A
EASG,Xtrackers MSCI EAFE ESG Leaders Equity ETF,TXN11-3,N,Tape B
EAST,"EASTSIDE DISTILLING , INC.",TXN14-8,N,Tape C
EAT,"Brinker International, Inc.",TXN9-1,Y,Tape A
EATV,VegTech Plant-based Innovation & Climate ETF,TXN11-5,N,Tape B
EATZ,AdvisorShares Restaurant ETF,TXN11-3,N,Tape B
EB,"Eventbrite, Inc. Class A Common Stock",TXN6-3,Y,Tape A
EBAY,eBay Inc,TXN13-7,N,Tape C
EBC,"Eastern Bankshares, Inc. Common Stock",TXN14-5,N,Tape C
EBF,"Ennis, Inc.",TXN5-8,Y,Tape A
EBIT,Harbor AlphaEdge Small Cap Earners ETF,TXN12-2,N,Tape B
EBIZ,Global X E-commerce ETF,TXN13-8,N,Tape C
EBMT,"Eagle Bancorp Montana, Inc",TXN14-7,N,Tape C
EBND,SPDR Bloomberg Emerging Markets Local Bond ETF,TXN10-8,N,Tape B
EBON,Ebang International Holdings Inc. Class A Ordinary Shares,TXN14-8,N,Tape C
EBR,Centrais Eltricas Brasileiras S.A.- Eletrobrs American Depositary Shares (Each representing one Co,TXN6-5,Y,Tape A
EBR B,Centrais Eltricas Brasileiras S.A.- Eletrobrs American Depositary Shares (Each representing one Pr,TXN9-8,Y,Tape A
EBS,"Emergent Biosolutions, Inc.",TXN2-2,Y,Tape A
EBTC,Enterprise Bancorp Inc.,TXN14-2,N,Tape C
EBUF,Innovator Emerging Markets 10 Buffer ETF - Quarterly,TXN10-3,N,Tape B
EC,Ecopetrol S.A,TXN7-2,Y,Tape A
ECAT,BlackRock ESG Capital Allocation Term Trust,TXN7-8,Y,Tape A
ECBK,"ECB Bancorp, Inc. Common Stock",TXN14-4,N,Tape C
ECC,EAGLE POINT CREDIT COMPANY INC.,TXN2-4,Y,Tape A
ECC PRD,Eagle Point Credit Company Inc. 6.75% Series D Preferred Stock,TXN9-8,Y,Tape A
ECCC,Eagle Point Credit Company Inc. 6.50% Series C Term Preferred Stock due 2031,TXN3-8,Y,Tape A
ECCF,Eagle Point Credit Company Inc. 8.00% Series F Term Preferred Stock due 2029,TXN8-8,Y,Tape A
ECCV,Eagle Point Credit Company Inc. 5.375% Notes due 2029,TXN3-8,Y,Tape A
ECCW,Eagle Point Credit Company Inc .6.75% Notes due 2031,TXN6-8,Y,Tape A
ECCX,Eagle Point Credit Company Inc. 6.6875% Notes due 2028,TXN9-8,Y,Tape A
ECDA,"ECD Automotive Design, Inc. Common Stock",TXN14-3,N,Tape C
ECDAW,"ECD Automotive Design, Inc. Warrant",TXN14-3,N,Tape C
ECF,Ellsworth Growth and Income Fund Ltd,TXN10-4,N,Tape B
ECF PRA,Ellsworth Growth and Income Fund Ltd. 5.25 percent Series A Cumulative Preferred Shares (Liquidation,TXN10-6,N,Tape B
ECG,"Everus Construction Group, Inc.",TXN1-7,Y,Tape A
ECH,iShares MSCI Chile ETF,TXN10-6,N,Tape B
ECL,"Ecolab, Inc.",TXN1-8,Y,Tape A
ECLN,First Trust EIP Carbon Impact ETF,TXN12-1,N,Tape B
ECML,Euclidean Fundamental Value ETF,TXN10-2,N,Tape B
ECNS,iShares MSCI China Small-Cap ETF,TXN11-2,N,Tape B
ECO,Okeanis Eco Tankers Corp.,TXN4-8,Y,Tape A
ECON,Columbia Research Enhanced Emerging Economies ETF,TXN12-2,N,Tape B
ECOR,"electroCore, Inc. Common Stock",TXN14-1,N,Tape C
ECOW,Pacer Emerging Markets Cash Cows 100 ETF,TXN14-6,N,Tape C
ECPG,"Encore Capital Group, Inc.",TXN14-4,N,Tape C
ECVT,Ecovyst Inc.,TXN8-2,Y,Tape A
ECX,ECARX Holdings Inc. Class A Ordinary shares,TXN13-8,N,Tape C
ECXWW,ECARX Holdings Inc. Warrants,TXN14-8,N,Tape C
ED,"Consolidated Edison, Inc.",TXN4-8,Y,Tape A
EDAP,EDAP TMS SA,TXN13-6,N,Tape C
EDBL,Edible Garden AG Incorporated Common Stock,TXN13-4,N,Tape C
EDBLW,Edible Garden AG Incorporated Warrant,TXN14-1,N,Tape C
EDC,"Direxion Daily Emerging Markets Bull 3X Shares, Shares of beneficial interest, no par value",TXN11-7,N,Tape B
EDD,"Morgan Stanley Emerging Markets Domestic Debt Fund, Inc.",TXN3-8,Y,Tape A
EDEN,iShares MSCI Denmark ETF,TXN10-6,N,Tape B
EDF,Virtus Stone Harbor Emerging Markets Income Fund,TXN7-8,Y,Tape A
EDGF,3EDGE Dynamic Fixed Income ETF,TXN11-4,N,Tape B
EDGH,3EDGE Dynamic Hard Assets ETF,TXN11-4,N,Tape B
EDGI,3EDGE Dynamic International Equity ETF,TXN10-7,N,Tape B
EDGU,3EDGE Dynamic US Equity ETF,TXN12-4,N,Tape B
EDIT,"Editas Medicine, Inc. Common Stock",TXN13-6,N,Tape C
EDIV,SPDR S&P Emerging Markets Dividend ETF,TXN12-4,N,Tape B
EDN,Empresa Distribuidora Y Comercializadora Norte S.A. (Edenor),TXN4-8,Y,Tape A
EDOC,Global X Telemedicine & Digital Health ETF,TXN14-6,N,Tape C
EDOG,ALPS Emerging Sector Dividend Dogs ETF,TXN11-3,N,Tape B
EDOW,First Trust Dow 30 Equal Weight ETF,TXN10-2,N,Tape B
EDR,"Endeavor Group Holdings, Inc.",TXN2-6,Y,Tape A
EDRY,EuroDry Ltd. Common Shares,TXN14-8,N,Tape C
EDSA,"Edesa Biotech, Inc. Common Shares",TXN13-3,N,Tape C
EDTK,Skillful Craftsman Education Technology Limited Ordinary Share,TXN14-5,N,Tape C
EDU,"New Oriental Education and Technology Group, Inc. American Depositary Shares (each representing ten ",TXN5-4,Y,Tape A
EDUC,Educational Development Corp,TXN14-2,N,Tape C
EDV,Vanguard World Funds Extended Duration ETF,TXN11-2,N,Tape B
EDZ,Direxion Daily Emerging Markets Bear 3x Shares,TXN11-2,N,Tape B
EE,"Excelerate Energy, Inc.",TXN9-8,Y,Tape A
EEA,"The European Equity Fund, Inc.",TXN4-8,Y,Tape A
EEFT,Euronet Worldwide Inc,TXN13-5,N,Tape C
EEIQ,EpicQuest Education Group International Limited Common Stock,TXN14-8,N,Tape C
EELV,Invesco S&P Emerging Markets Low Volatility ETF,TXN12-5,N,Tape B
EEM,iShares MSCI Emerging Markets ETF,TXN10-7,N,Tape B
EEMA,iShares MSCI Emerging Markets Asia ETF,TXN13-4,N,Tape C
EEMO,Invesco S&P Emerging Markets Momentum ETF,TXN10-8,N,Tape B
EEMS,iShares MSCI Emerging Markets Small-Cap ETF,TXN10-5,N,Tape B
EEMV,iShares MSCI Emerging Markets Min Vol Factor ETF,TXN11-1,N,Tape B
EEMX,SPDR MSCI Emerging Markets Fossil Fuel Reserves Free ETF,TXN11-4,N,Tape B
EES,WisdomTree U.S. SmallCap Fund,TXN12-3,N,Tape B
EET,ProShares Ultra MSCI Emerging Markets,TXN10-3,N,Tape B
EETH,ProShares Ether ETF,TXN12-8,N,Tape B
EEV,ProShares Trust UltraShort MSCI Emerging Markets,TXN11-2,N,Tape B
EEX,"Emerald Holding, Inc.",TXN5-8,Y,Tape A
EFA,iShares MSCI EAFE ETF,TXN11-3,N,Tape B
EFAA,Invesco MSCI EAFE Income Advantage ETF,TXN12-7,N,Tape B
EFAD,ProShares MSCI EAFE Dividend Growers ETF,TXN11-1,N,Tape B
EFAS,Global X MSCI SuperDividend EAFE ETF,TXN13-5,N,Tape C
EFAV,iShares MSCI EAFE Min Vol Factor ETF,TXN10-2,N,Tape B
EFAX,SPDR MSCI EAFE Fossil Fuel Reserves Free ETF,TXN10-2,N,Tape B
EFC,Ellington Financial Inc. Common Stock,TXN1-8,Y,Tape A
EFC PRA,Ellington Financial Inc. 6.750% Series A Fixed-to-Floating Rate Cumulative Redeemable Preferred Stoc,TXN7-8,Y,Tape A
EFC PRB,Ellington Financial Inc. 6.250% Series B Fixed-Rate Reset Cumulative Redeemable Preferred Stock,TXN4-8,Y,Tape A
EFC PRC,Ellington Financial Inc. 8.625% Series C Fixed-Rate Reset Cumulative Redeemable Preferred Stock,TXN2-8,Y,Tape A
EFC PRD,Ellington Financial Inc. 7.00% Series D Cumulative Perpetual Redeemable Preferred Stock,TXN3-8,Y,Tape A
EFC PRE,Ellington Financial Inc. 8.250% Series E Fixed-to-Floating Rate Cumulative Redeemable Preferred Stoc,TXN1-8,Y,Tape A
EFG,iShares MSCI EAFE Growth ETF,TXN11-1,N,Tape B
EFIV,SPDR S&P 500 ESG ETF,TXN10-6,N,Tape B
EFIX,First Trust TCW Emerging Markets Debt ETF,TXN11-3,N,Tape B
EFNL,iShares MSCI Finland ETF,TXN12-8,N,Tape B
EFO,ProShares Ultra MSCI EAFE,TXN10-6,N,Tape B
EFOI,"Energy Focus, Inc.",TXN14-5,N,Tape C
EFR,Eaton Vance Senior Floating-Rate Fund,TXN4-8,Y,Tape A
EFRA,iShares Environmental Infrastructure and Industrials ETF,TXN14-3,N,Tape C
EFSC,Enterprise Financial Services Corporation,TXN14-3,N,Tape C
