IMSI,Invesco Municipal Strategic Income ETF,TXN11-5,N,Tape B
IMTB,iShares Core 5-10 Year USD Bond ETF,TXN12-5,N,Tape B
IMTE,Integrated Media Technology Limited Ordinary Shares,TXN14-2,N,Tape C
IMTM,iShares MSCI Intl Momentum Factor ETF,TXN12-6,N,Tape B
IMTX,Immatics N.V. Ordinary Shares,TXN14-1,N,Tape C
IMTXW,Immatics N.V. Warrants,TXN14-6,N,Tape C
IMUX,"Immunic, Inc. Common Stock",TXN14-3,N,Tape C
IMVT,"Immunovant, Inc. Common Stock",TXN13-2,N,Tape C
IMXI,"International Money Express, Inc.",TXN14-5,N,Tape C
INAB,"IN8bio, Inc. Common Stock",TXN14-2,N,Tape C
INAQ,Insight Acquisition Corp. Class A Common Stock,TXN13-8,N,Tape C
INAQU,Insight Acquisition Corp. Units,TXN13-6,N,Tape C
INAQW,Insight Acquisition Corp. Warrant,TXN13-4,N,Tape C
INBK,First Internet Bancorp,TXN13-4,N,Tape C
INBKZ,First Internet Bancorp 6.0% Fixed-to-Floating Rate Subordinated Notes Due 2029,TXN13-4,N,Tape C
INBS,Intelligent Bio Solutions Inc. Common Stock,TXN14-3,N,Tape C
INBX,"Inhibrx Biosciences, Inc. Common Stock",TXN14-2,N,Tape C
INCE,Franklin Income Equity Focus ETF,TXN10-2,N,Tape B
INCM,Franklin Income Focus ETF,TXN10-4,N,Tape B
INCO,Columbia India Consumer ETF,TXN11-8,N,Tape B
INCR,Intercure Ltd. Ordinary Shares,TXN14-7,N,Tape C
INCY,Incyte Genomics Inc,TXN14-5,N,Tape C
INDA,iShares MSCI India ETF,TXN10-7,N,Tape B
INDB,Independent Bank Corp/MA,TXN13-4,N,Tape C
INDE,Matthews India Active ETF,TXN12-2,N,Tape B
INDF,Range India Financials ETF,TXN10-8,N,Tape B
INDH,WisdomTree India Hedged Equity Fund,TXN14-3,N,Tape C
INDI,"indie Semiconductor, Inc. Class A Common Stock",TXN14-6,N,Tape C
INDL,Direxion Daily MSCI India Bull 2X Shares,TXN12-8,N,Tape B
INDO,Indonesia Energy Corporation Limited,TXN10-2,N,Tape B
INDP,"Indaptus Therapeutics, Inc. Common Stock",TXN14-7,N,Tape C
INDS,Pacer Industrial Real Estate ETF,TXN10-1,N,Tape B
INDV,Indivior PLC Ordinary Shares,TXN13-3,N,Tape C
INDY,iShares S&P India Nifty 50 Index Fund,TXN13-2,N,Tape C
INEQ,Columbia International Equity Income ETF,TXN12-4,N,Tape B
INFA,Informatica Inc.,TXN5-2,Y,Tape A
INFL,Horizon Kinetics Inflation Beneficiaries ETF,TXN11-8,N,Tape B
INFN,Infinera Corporation Common Stock,TXN14-1,N,Tape C
INFO,Harbor PanAgora Dynamic Large Cap Core ETF,TXN10-2,N,Tape B
INFR,ClearBridge Sustainable Infrastructure ETF,TXN14-4,N,Tape C
INFU,"InfuSystem Holdings, Inc.",TXN11-7,N,Tape B
INFY,Infosys Limited American Depositary Shares,TXN8-5,Y,Tape A
ING,ING Groep N.V. American Depositary Shares,TXN5-7,Y,Tape A
INGM,Ingram Micro Holding Corporation,TXN1-8,Y,Tape A
INGN,Inogen Inc,TXN14-8,N,Tape C
INGR,Ingredion Incorporated,TXN7-8,Y,Tape A
INHD,Inno Holdings Inc. Common Stock,TXN13-2,N,Tape C
INKM,SPDR SSgA Income Allocation ETF of SSgA Active Trust,TXN11-6,N,Tape B
INKT,"MiNK Therapeutics, Inc. Common Stock",TXN13-6,N,Tape C
INLX,"Intellinetics, Inc.",TXN10-4,N,Tape B
INM,InMed Pharmaceuticals Inc. Common Shares,TXN14-2,N,Tape C
INMB,INmune Bio Inc. Common stock,TXN13-8,N,Tape C
INMD,InMode Ltd. Ordinary Shares,TXN14-7,N,Tape C
INMU,iShares Intermediate Muni Income Active ETF,TXN12-6,N,Tape B
INN,"Summit Hotel Properties, Inc.",TXN7-5,Y,Tape A
INN PRE,"Summit Hotel Properties, Inc. 6.250% Series E Cumulative Redeemable Preferred Stock",TXN7-8,Y,Tape A
INN PRF,"Summit Hotel Properties, Inc. 5.875% Series F Cumulative Redeemable Preferred Stock",TXN3-8,Y,Tape A
INNO,Harbor Disruptive Innovation ETF,TXN12-4,N,Tape B
INNV,InnovAge Holding Corp. Common Stock,TXN14-2,N,Tape C
INO,"Inovio Pharmaceuticals, Inc.",TXN13-5,N,Tape C
INOD,Innodata Inc.,TXN13-3,N,Tape C
INOV,Innovator International Developed Power Buffer ETF - November,TXN11-3,N,Tape B
INQQ,INQQ The India Internet ETF,TXN11-2,N,Tape B
INRO,BlackRock ETF Trust iShares U.S. Industry Rotation Active ETF,TXN13-5,N,Tape C
INSE,"Inspired Entertainment, Inc.",TXN14-3,N,Tape C
INSG,Inseego Corp. Common Stock,TXN14-3,N,Tape C
INSI,Insight Select Income Fund,TXN5-8,Y,Tape A
INSM,"Insmed, Inc.",TXN13-3,N,Tape C
INSP,"Inspire Medical Systems, Inc.",TXN5-4,Y,Tape A
INSW,"International Seaways, Inc. Common Stock",TXN2-4,Y,Tape A
INTA,"Intapp, Inc. Common Stock",TXN14-4,N,Tape C
INTC,Intel Corp,TXN14-1,N,Tape C
INTF,iShares International Equity Factor ETF,TXN11-1,N,Tape B
INTG,Intergroup Corporation (The),TXN14-2,N,Tape C
INTJ,Intelligent Group Limited Ordinary Shares,TXN13-4,N,Tape C
INTL,Main International ETF,TXN12-5,N,Tape B
INTR,Inter & Co. Inc. Class A Common Shares,TXN14-8,N,Tape C
INTS,"Intensity Therapeutics, Inc. Common stock",TXN14-5,N,Tape C
INTT,inTEST Corporation,TXN10-8,N,Tape B
INTU,Intuit Inc,TXN14-3,N,Tape C
INTZ,Intrusion Inc New,TXN14-4,N,Tape C
INUV,"Inuvo, Inc.",TXN12-8,N,Tape B
INV,"Innventure, Inc. Common Stock",TXN13-3,N,Tape C
INVA,"Innoviva, Inc. Common Stock",TXN13-5,N,Tape C
INVE,"Identive, Inc.",TXN14-2,N,Tape C
INVH,Invitation Homes Inc. Common Stock,TXN4-1,Y,Tape A
INVX,"Innovex International, Inc.",TXN9-6,Y,Tape A
INVZ,Innoviz Technologies Ltd. Ordinary shares,TXN14-4,N,Tape C
INVZW,Innoviz Technologies Ltd. Warrant,TXN13-7,N,Tape C
INZY,"Inozyme Pharma, Inc. Common Stock",TXN13-4,N,Tape C
IOBT,"IO Biotech, Inc. Common Stock",TXN13-2,N,Tape C
IOCT,Innovator International Developed Power Buffer ETF-October,TXN12-5,N,Tape B
ION,ProShares S&P Global Core Battery Metals ETF,TXN10-7,N,Tape B
IONQ,"IonQ, Inc.",TXN3-1,Y,Tape A
IONQ WS,"IonQ, Inc. Redeemable warrants, each whole warrant exercisable for one share of Common Stock, each a",TXN3-2,Y,Tape A
IONR,ioneer Ltd American Depositary Shares,TXN13-4,N,Tape C
IONS,"Ionis Pharmaceuticals, Inc. Common Stock",TXN14-6,N,Tape C
IOO,iShares Global 100 ETF,TXN11-2,N,Tape B
IOPP,Simplify Tara India Opportunities ETF,TXN11-2,N,Tape B
IOR,"Income Opportunity Realty Investors, Inc.",TXN11-5,N,Tape B
IOSP,Innospec Inc.,TXN13-1,N,Tape C
IOT,Samsara Inc.,TXN6-7,Y,Tape A
IOVA,"Iovance Biotherapeutics, Inc. Common Stock",TXN13-5,N,Tape C
IP,International Paper Co.,TXN9-8,Y,Tape A
IPA,IMMUNOPRECISE ANTIBODIES LTD,TXN14-1,N,Tape C
IPAC,iShares Core MSCI Pacific ETF,TXN10-5,N,Tape B
IPAR,"Interparfums, Inc. Common Stock",TXN14-8,N,Tape C
IPAV,Global X Infrastructure Development ex-U.S. ETF,TXN12-2,N,Tape B
IPAY,Amplify Digital Payments ETF,TXN11-2,N,Tape B
IPB,Merrill Lynch Depositor Inc. 6.0518% Index Plus Trust Certificates Series 2003-1,TXN9-8,Y,Tape A
IPDN,"Professional Diversity Network, Inc.",TXN14-6,N,Tape C
IPDP,Dividend Performers ETF,TXN10-2,N,Tape B
IPG,"The Interpublic Group of Companies, Inc.",TXN9-3,Y,Tape A
IPGP,IPG Photonics Corporation,TXN13-1,N,Tape C
IPHA,Innate Pharma S.A. ADS,TXN14-3,N,Tape C
IPI,"Intrepid Potash, Inc",TXN7-8,Y,Tape A
IPKW,Invesco International BuyBack Achievers  ETF,TXN14-4,N,Tape C
IPO,Renaissance IPO ETF,TXN11-2,N,Tape B
IPOS,Renaissance International IPO ETF,TXN12-4,N,Tape B
IPPP,Preferred-Plus ETF,TXN11-5,N,Tape B
IPSC,"Century Therapeutics, Inc. Common Stock",TXN14-7,N,Tape C
IPW,"iPower, Inc. Common Stock",TXN13-1,N,Tape C
IPWR,Ideal Power Inc.,TXN13-1,N,Tape C
IPX,IperionX Limited American Depositary Share,TXN13-3,N,Tape C
IPXX,Inflection Point Acquisition Corp. II Class A Ordinary Share,TXN14-3,N,Tape C
IPXXU,Inflection Point Acquisition Corp. II Unit,TXN13-6,N,Tape C
IPXXW,Inflection Point Acquisition Corp. II Warrant,TXN13-1,N,Tape C
IQ,"iQIYI, Inc. American Depositary Shares",TXN13-2,N,Tape C
IQDE,FlexShares International Quality Dividend Defensive Index Fund,TXN12-3,N,Tape B
IQDF,FlexShares International Quality Dividend Index Fund,TXN12-4,N,Tape B
IQDG,WisdomTree International Quality Dividend Growth Fund,TXN10-4,N,Tape B
IQDY,FlexShares International Quality Dividend Dynamic Index Fund,TXN10-7,N,Tape B
IQHI,NYLI MacKay ESG High Income ETF,TXN11-1,N,Tape B
IQI,INVESCO QUALITY MUNICIPAL SECURITIES,TXN6-8,Y,Tape A
IQLT,iShares MSCI Intl Quality Factor ETF,TXN10-6,N,Tape B
IQM,Franklin Intelligent Machines ETF,TXN11-3,N,Tape B
IQQQ,ProShares Nasdaq-100 High Income ETF,TXN13-4,N,Tape C
IQRA,NYLI CBRE Real Assets ETF,TXN11-3,N,Tape B
IQSI,NYLI Candriam International Equity ETF,TXN10-2,N,Tape B
IQSM,NYLI Candriam U.S. Mid Cap Equity ETF,TXN10-8,N,Tape B
IQSU,NYLI Candriam U.S. Large Cap Equity ETF,TXN12-1,N,Tape B
IQV,IQVIA Holdings Inc.,TXN9-7,Y,Tape A
IR,Ingersoll Rand Inc. Common Stock,TXN6-2,Y,Tape A
IRBT,iRobot Corporation,TXN14-8,N,Tape C
IRD,"Opus Genetics, Inc. Common Stock",TXN13-6,N,Tape C
IRDM,Iridium Communications Inc.,TXN13-4,N,Tape C
IREN,Iris Energy Limited Ordinary Shares,TXN14-7,N,Tape C
IRET,iREIT MarketVector Quality REIT Index ETF,TXN12-5,N,Tape B
IRIX,Iridex Corp,TXN13-3,N,Tape C
IRM,Iron Mountain Inc.,TXN6-4,Y,Tape A
IRMD,iRadimed Corporation,TXN14-4,N,Tape C
IROH,Iron Horse Acquisitions Corp. Common Stock,TXN13-3,N,Tape C
IROHR,Iron Horse Acquisitions Corp. Right,TXN13-3,N,Tape C
IROHU,Iron Horse Acquisitions Corp. Unit,TXN13-8,N,Tape C
IROHW,Iron Horse Acquisitions Corp. Warrant,TXN14-7,N,Tape C
IRON,"Disc Medicine, Inc. Common Stock",TXN13-1,N,Tape C
IROQ,"IF Bancorp, Inc.",TXN13-5,N,Tape C
IRS,IRSA Inversiones y Representaciones S.A. Global Depositary Shares,TXN9-5,Y,Tape A
IRS WS,IRSA Inversiones y Representaciones S.A. Warrants to purchase Common Shares,TXN1-8,Y,Tape A
IRT,Independence Realty Trust Inc.,TXN1-6,Y,Tape A
IRTC,"iRhythm Technologies, Inc",TXN13-3,N,Tape C
IRTR,iShares LifePath Retirement ETF,TXN12-5,N,Tape B
IRVH,Global X Interest Rate Volatility & Inflation Hedge ETF,TXN11-7,N,Tape B
IRWD,"Ironwood Pharmaceuticals, Inc. - Class A",TXN13-1,N,Tape C
ISCB,iShares Morningstar Small-Cap ETF,TXN12-3,N,Tape B
ISCF,iShares International Small Cap Equity Factor ETF,TXN12-3,N,Tape B
ISCG,iShares Morningstar Small-Cap Growth ETF,TXN11-5,N,Tape B
ISCV,iShares Morningstar Small-Cap Value ETF,TXN10-6,N,Tape B
ISD,"PGIM High Yield Bond Fund, Inc.",TXN3-8,Y,Tape A
ISDB,Invesco Short Duration Bond ETF,TXN12-5,N,Tape B
ISDR,Issuer Direct Corporation,TXN10-1,N,Tape B
ISEP,Innovator International Developed Power Buffer ETF - September,TXN11-8,N,Tape B
ISHG,iShares International Treasury Bond ETF,TXN13-4,N,Tape C
ISHP,First Trust Exchange-Traded Fund VI First Trust S-Network E-Commerce ETF,TXN14-8,N,Tape C
ISMD,Inspire Small/Mid Cap ETF,TXN12-5,N,Tape B
ISPC,iSpecimen Inc. Common Stock,TXN14-6,N,Tape C
ISPO,Inspirato Incorporated Class A Common Stock,TXN13-5,N,Tape C
ISPOW,Inspirato Incorporated Warrant,TXN14-3,N,Tape C
ISPR,Ispire Technology Inc. Common Stock,TXN13-3,N,Tape C
ISPY,ProShares S&P 500 High Income ETF,TXN12-5,N,Tape B
ISRA,VanEck Israel ETF,TXN12-1,N,Tape B
ISRG,Intuitive Surgical Inc.,TXN14-7,N,Tape C
ISRL,Israel Acquisitions Corp Class A Ordinary Shares,TXN13-6,N,Tape C
ISRLU,Israel Acquisitions Corp Unit,TXN13-2,N,Tape C
ISRLW,Israel Acquisitions Corp Warrant,TXN14-3,N,Tape C
ISSC,Innovative Solutions & Support,TXN14-6,N,Tape C
ISTB,iShares Core 1-5 Year USD Bond ETF of iShares Trust,TXN13-3,N,Tape C
ISTR,Investar Holding Corporation,TXN14-1,N,Tape C
ISVL,iShares International Developed Small Cap Value Factor ETF,TXN10-3,N,Tape B
ISWN,Amplify BlackSwan ISWN ETF,TXN11-8,N,Tape B
IT,"Gartner, Inc.",TXN5-8,Y,Tape A
ITA,iShares U.S. Aerospace & Defense ETF,TXN10-4,N,Tape B
ITAN,Sparkline Intangible Value ETF,TXN10-6,N,Tape B
ITB,iShares U.S. Home Construction ETF,TXN12-4,N,Tape B
ITCI,Intra-Cellular Therapies Inc.,TXN14-3,N,Tape C
ITDB,iShares LifePath Target Date 2030 ETF,TXN11-7,N,Tape B
ITDC,iShares LifePath Target Date 2035 ETF,TXN12-8,N,Tape B
ITDD,iShares LifePath Target Date 2040 ETF,TXN11-3,N,Tape B
ITDE,iShares LifePath Target Date 2045 ETF,TXN11-7,N,Tape B
ITDF,iShares LifePath Target Date 2050 ETF,TXN11-8,N,Tape B
ITDG,iShares LifePath Target Date 2055 ETF,TXN12-5,N,Tape B
ITDH,iShares LifePath Target Date 2060 ETF,TXN12-3,N,Tape B
ITDI,iShares LifePath Target Date 2065 ETF,TXN10-1,N,Tape B
ITDJ,iShares LifePath Target Date 2070 ETF,TXN12-4,N,Tape B
ITEQ,Amplify BlueStar Israel Technology ETF,TXN11-7,N,Tape B
ITGR,Integer Holdings Corporation,TXN1-8,Y,Tape A
ITIC,Investors Title Co,TXN13-6,N,Tape C
ITM,VanEck Intermediate Muni ETF,TXN11-6,N,Tape B
ITOS,"iTeos Therapeutics, Inc. Common Stock",TXN13-8,N,Tape C
ITOT,iShares Core S&P Total U.S. Stock Market ETF,TXN11-5,N,Tape B
ITP,"IT Tech Packaging, Inc.",TXN10-7,N,Tape B
ITRG,Integra Resources Corp.,TXN10-8,N,Tape B
ITRI,Itron Inc,TXN14-1,N,Tape C
ITRM,Iterum Therapeutics plc Ordinary Share,TXN14-3,N,Tape C
ITRN,Ituran Location and Control Ltd.,TXN14-5,N,Tape C
ITT,ITT Inc.,TXN2-8,Y,Tape A
ITUB,Itau Unibanco Holding S.A. American Depositary Shares,TXN2-2,Y,Tape A
ITW,Illinois Tool Works Inc.,TXN7-6,Y,Tape A
ITWO,ProShares Russell 2000 High Income ETF,TXN10-3,N,Tape B
IUS,Invesco Exchange-Traded Self-Indexed Fund Trust Invesco RAFI Strategic US ETF,TXN13-8,N,Tape C
IUSB,iShares Core Total USD Bond Market ETF,TXN13-3,N,Tape C
IUSG,iShares Core S&P U.S. Growth ETF,TXN14-3,N,Tape C
IUSV,iShares Core S&P U.S. Value ETF,TXN13-6,N,Tape C
IVA,Inventiva S.A. American Depository Shares,TXN14-7,N,Tape C
IVAC,Intevac Inc,TXN14-6,N,Tape C
IVAL,Alpha Architect International Quantitative Value ETF,TXN13-6,N,Tape C
IVCA,Investcorp AI Acquisition Corp. Class A Ordinary Share,TXN13-6,N,Tape C
IVCAU,Investcorp AI Acquisition Corp. Unit,TXN13-6,N,Tape C
IVCAW,Investcorp AI Acquisition Corp. Warrant,TXN13-4,N,Tape C
IVCB,Investcorp Europe Acquisition Corp I Class A Ordinary Shares,TXN14-5,N,Tape C
IVCBU,Investcorp Europe Acquisition Corp I Unit,TXN14-5,N,Tape C
IVCBW,Investcorp Europe Acquisition Corp I Warrant,TXN14-4,N,Tape C
IVCP,Swiftmerge Acquisition Corp. Class A Ordinary Share,TXN13-4,N,Tape C
IVCPU,Swiftmerge Acquisition Corp. Unit,TXN13-2,N,Tape C
IVCPW,Swiftmerge Acquisition Corp. Warrants,TXN13-6,N,Tape C
IVDA,"Iveda Solutions, Inc. Common Stock",TXN13-7,N,Tape C
IVDAW,"Iveda Solutions, Inc. Warrant",TXN14-4,N,Tape C
IVE,iShares S&P 500 Value ETF,TXN11-8,N,Tape B
IVEG,iShares Emergent Food and AgTech Multisector ETF,TXN13-2,N,Tape C
IVLU,iShares MSCI Intl Value Factor ETF,TXN11-1,N,Tape B
IVOG,Vanguard S&P Mid-Cap 400 Growth ETF,TXN10-5,N,Tape B
IVOL,Quadratic Interest Rate Volatility and Inflation Hedge ETF,TXN12-6,N,Tape B
IVOO,Vanguard S&P Mid-Cap 400 ETF,TXN11-5,N,Tape B
IVOV,Vanguard S&P Mid-Cap 400 Value ETF,TXN12-5,N,Tape B
IVP,"Inspire Veterinary Partners, Inc. Class A Common Stock",TXN13-7,N,Tape C
IVR,Invesco Mortgage Capital Inc.,TXN9-4,Y,Tape A
IVR PRB,INVESCO MORTGAGE CAPITAL INC. 7.75% Fixed-To-Floating Series B Cumulative Redeemable Preferred Stock,TXN7-8,Y,Tape A
IVR PRC,"Invesco Mortgage Capital Inc. 7.5% Fixed-to-Floating Series C Cumulative Redeemable Preferred Stock,",TXN2-8,Y,Tape A
IVRA,Invesco Real Assets ESG ETF,TXN12-5,N,Tape B
IVRS,iShares Future Metaverse Tech and Communications ETF,TXN11-7,N,Tape B
IVT,InvenTrust Properties Corp.,TXN8-4,Y,Tape A
IVV,iShares Core S&P 500 ETF,TXN12-1,N,Tape B
IVVB,iShares Large Cap Deep Buffer ETF,TXN10-1,N,Tape B
IVVD,"Invivyd, Inc. Common Stock",TXN13-2,N,Tape C
IVVM,iShares Large Cap Moderate Buffer ETF,TXN11-6,N,Tape B
IVVW,iShares S&P 500 BuyWrite ETF,TXN11-8,N,Tape B
IVW,iShares S&P 500 Growth ETF,TXN12-8,N,Tape B
IVZ,Invesco LTD,TXN7-5,Y,Tape A
IWB,iShares Russell 1000 ETF,TXN10-1,N,Tape B
IWC,iShares Micro-Cap ETF,TXN10-4,N,Tape B
IWD,iShares Russell 1000 Value ETF,TXN12-4,N,Tape B
IWDL,ETRACS 2x Leveraged US Value Factor TR ETN,TXN11-7,N,Tape B
IWF,iShares Russell 1000 Growth ETF,TXN10-7,N,Tape B
IWFG,NYLI Winslow Focused Large Cap Growth ETF,TXN10-4,N,Tape B
IWFL,ETRACS 2x Leveraged US Growth Factor TR ETN,TXN10-5,N,Tape B
IWL,iShares Russell Top 200 ETF,TXN11-2,N,Tape B
IWLG,NYLI Winslow Large Cap Growth ETF,TXN10-7,N,Tape B
IWM,iShares Russell 2000 ETF,TXN11-1,N,Tape B
IWMI,NEOS Russell 2000 High Income ETF,TXN11-3,N,Tape B
IWML,ETRACS 2x Leveraged US Size Factor TR ETN,TXN11-3,N,Tape B
IWMW,iShares Russell 2000 BuyWrite ETF,TXN10-6,N,Tape B
IWMY,Defiance R2000 Enhanced Options & 0DTE Income ETF,TXN10-6,N,Tape B
IWN,iShares Russell 2000 Value ETF,TXN12-6,N,Tape B
IWO,iShares Russell 2000 Growth ETF,TXN11-4,N,Tape B
IWP,iShares Russell Mid-Cap Growth ETF,TXN11-3,N,Tape B
IWR,iShares Russell Mid-Cap ETF,TXN12-7,N,Tape B
IWS,iShares Russell Mid-Cap Value ETF,TXN12-1,N,Tape B
IWTR,iShares MSCI Water Management Multisector ETF,TXN13-2,N,Tape C
IWV,iShares Russell 3000 ETF,TXN11-2,N,Tape B
IWX,iShares Russell Top 200 Value ETF,TXN10-6,N,Tape B
IWY,iShares Russell Top 200 Growth ETF,TXN10-4,N,Tape B
IX,ORIX Corporation,TXN8-8,Y,Tape A
IXC,iShares Global Energy ETF,TXN10-1,N,Tape B
IXG,iShares Global Financials ETF,TXN10-3,N,Tape B
IXHL,Incannex Healthcare Limited American Depositary Shares,TXN13-3,N,Tape C
IXJ,iShares Global Healthcare ETF,TXN12-6,N,Tape B
IXN,iShares Global Tech ETF,TXN11-1,N,Tape B
IXP,iShares Global Comm Services ETF,TXN11-8,N,Tape B
IXUS,iShares Core MSCI Total International Stock ETF,TXN14-5,N,Tape C
IYC,iShares U.S. Consumer Discretionary ETF,TXN10-6,N,Tape B
IYE,iShares U.S. Energy ETF,TXN12-5,N,Tape B
IYF,iShares U.S. Financials ETF,TXN12-7,N,Tape B
IYG,iShares U.S. Financial Services ETF,TXN10-1,N,Tape B
IYH,iShares U.S. Healthcare ETF,TXN10-3,N,Tape B
IYJ,iShares U.S. Industrials ETF,TXN11-8,N,Tape B
IYK,iShares U.S. Consumer Staples ETF,TXN12-8,N,Tape B
IYLD,iShares Morningstar Multi-Asset Income ETF,TXN12-5,N,Tape B
IYM,iShares U.S. Basic Materials ETF,TXN10-5,N,Tape B
IYR,iShares U.S. Real Estate ETF,TXN12-1,N,Tape B
IYT,iShares U.S. Transportation ETF,TXN10-5,N,Tape B
IYW,iShares U.S. Technology ETF,TXN12-3,N,Tape B
IYY,iShares Dow Jones U.S. ETF,TXN11-5,N,Tape B
IYZ,iShares U.S. Telecommunications ETF,TXN10-2,N,Tape B
IZEA,"IZEA Worldwide, Inc. Common Stock",TXN14-3,N,Tape C
IZM,ICZOOM Group Inc. Class A Ordinary Shares,TXN14-3,N,Tape C
IZRL,ARK Israel Innovative Technology ETF,TXN12-1,N,Tape B
IZTC,Invizyne Technologies Inc. Common Stock,TXN14-5,N,Tape C
J,Jacobs Solutions Inc.,TXN8-8,Y,Tape A
JAAA,Janus Henderson AAA CLO ETF,TXN12-2,N,Tape B
JACK,Jack in the Box Inc.,TXN13-1,N,Tape C
JADE,JPMorgan Active Developing Markets Equity ETF,TXN11-5,N,Tape B
JAGX,"Jaguar Health, Inc.",TXN14-8,N,Tape C
JAJL,Innovator Equity Defined Protection ETF - 6mo Jan/Jul,TXN10-1,N,Tape B
JAKK,Jakks Pacific Inc,TXN14-7,N,Tape C
JAMF,Jamf Holding Corp. Common Stock,TXN14-4,N,Tape C
JAND,Innovator Premium Income 10 Barrier ETF - January,TXN11-4,N,Tape B
JANH,Innovator Premium Income 20 Barrier ETF - January,TXN11-2,N,Tape B
JANJ,Innovator Premium Income 30 Barrier ETF - January,TXN11-6,N,Tape B
JANP,PGIM US Large-Cap Buffer 12 ETF - January,TXN12-2,N,Tape B
JANQ,Innovator Premium Income 40 Barrier ETF - January,TXN12-4,N,Tape B
JANT,AllianzIM U.S. Large Cap Buffer10 Jan ETF,TXN12-7,N,Tape B
JANW,AllianzIM U.S. Large Cap Buffer20 Jan ETF,TXN12-1,N,Tape B
JANX,"Janux Therapeutics, Inc. Common Stock",TXN13-7,N,Tape C
JANZ,TrueShares Structured Outcome (January) ETF,TXN10-5,N,Tape B
JAVA,JPMorgan Active Value ETF,TXN12-4,N,Tape B
JAZZ,"Jazz Pharmaceuticals, Inc.",TXN14-6,N,Tape C
JBBB,Janus Henderson B-BBB CLO ETF,TXN11-6,N,Tape B
JBDI,JBDI Holdings Limited Ordinary Shares,TXN13-1,N,Tape C
JBGS,JBG SMITH Properties Common Shares,TXN7-4,Y,Tape A
JBHT,JB Hunt Transport Services Inc,TXN13-1,N,Tape C
JBI,"Janus International Group, Inc.",TXN6-3,Y,Tape A
JBK,Lehman ABS Corp 3.50 Adj Corp Backed Tr Cert Goldman Cap I,TXN1-8,Y,Tape A
JBL,Jabil Inc.,TXN9-1,Y,Tape A
JBLU,JetBlue Airways Corp,TXN13-4,N,Tape C
JBND,JPMorgan Active Bond ETF,TXN7-8,Y,Tape A
JBSS,John B. Sanfilippo & SON,TXN14-6,N,Tape C
JBT,John Bean Technologies Corporation,TXN2-7,Y,Tape A
JCE,Nuveen Core Equity Alpha Fund,TXN3-8,Y,Tape A
JCHI,JPMorgan Active China ETF,TXN10-1,N,Tape B
JCI,Johnson Controls International plc,TXN5-6,Y,Tape A
JCPB,JPMorgan Core Plus Bond ETF,TXN12-4,N,Tape B
JCPI,JPMorgan Inflation Managed Bond ETF,TXN10-1,N,Tape B
JCSE,JE Cleantech Holdings Limited Ordinary Shares,TXN13-7,N,Tape C
JCTC,Jewett-Cameron Trading,TXN13-5,N,Tape C
JCTR,JPMorgan Carbon Transition U.S. Equity ETF,TXN10-4,N,Tape B
JD,"JD.com, Inc.",TXN14-2,N,Tape C
JDIV,JPMorgan Dividend Leaders ETF,TXN11-5,N,Tape B
JDOC,JPMorgan Healthcare Leaders ETF,TXN14-3,N,Tape C
JDST,Direxion Daily Junior Gold Miners Index Bear 2X Shares,TXN10-2,N,Tape B
JDVI,John Hancock Disciplined Value International Select ETF,TXN12-8,N,Tape B
JDZG,JIADE LIMITED Common stock,TXN13-5,N,Tape C
JEF,Jefferies Financial Group Inc.,TXN3-8,Y,Tape A
JELD,"JELD-WEN Holding, Inc.",TXN7-4,Y,Tape A
JEMA,JPMorgan ActiveBuilders Emerging Markets Equity ETF,TXN11-1,N,Tape B
JEMB,Janus Henderson Emerging Markets Debt Hard Currency ETF,TXN12-5,N,Tape B
JEPI,JPMorgan Equity Premium Income ETF,TXN10-3,N,Tape B
JEPQ,J.P. Morgan Nasdaq Equity Premium Income ETF,TXN14-4,N,Tape C
JEQ,"abrdn Japan Equity Fund, Inc.",TXN2-8,Y,Tape A
JETD,MAX Airlines -3x Inverse Leveraged ETN,TXN12-7,N,Tape B
JETS,U.S. Global Jets ETF,TXN12-6,N,Tape B
JETU,MAX Airlines 3x Leveraged ETN,TXN11-6,N,Tape B
JFBR,Jeffs' Brands Ltd Ordinary Shares,TXN14-3,N,Tape C
JFBRW,Jeffs' Brands Ltd Warrant,TXN14-5,N,Tape C
JFIN,Jiayin Group Inc. American Depositary Shares,TXN14-3,N,Tape C
JFR,Nuveen Floating Rate Income Fund,TXN7-8,Y,Tape A
JFU,9F Inc. American Depositary Shares,TXN14-8,N,Tape C
JFWD,Jacob Forward ETF,TXN10-5,N,Tape B
JG,Aurora Mobile Limited American Depositary Shares,TXN13-2,N,Tape C
JGH,NUVEEN GLOBAL HIGH INCOME FUND,TXN2-8,Y,Tape A
JGLO,JPMorgan Global Select Equity ETF,TXN13-6,N,Tape C
JGRO,JPMorgan Active Growth ETF,TXN12-1,N,Tape B
JGRW,Jensen Quality Growth ETF,TXN11-5,N,Tape B
JHAC,John Hancock Fundamental All Cap Core ETF,TXN10-8,N,Tape B
JHCB,John Hancock Corporate Bond ETF,TXN11-7,N,Tape B
JHDV,John Hancock U.S. High Dividend ETF,TXN12-8,N,Tape B
JHEM,John Hancock Multifactor Emerging Markets ETF,TXN12-2,N,Tape B
JHG,Janus Henderson Group plc Ordinary Shares,TXN6-6,Y,Tape A
JHHY,John Hancock High Yield ETF,TXN11-5,N,Tape B
JHI,John Hancock Investors Trust Capital Stock,TXN9-8,Y,Tape A
JHID,John Hancock International High Dividend ETF,TXN11-1,N,Tape B
JHMB,John Hancock Mortgage-Backed Securities ETF,TXN10-8,N,Tape B
JHMD,John Hancock Multifactor Developed International ETF,TXN11-8,N,Tape B
JHML,John Hancock Multifactor Large Cap ETF,TXN10-7,N,Tape B
JHMM,John Hancock Multifactor Mid Cap ETF,TXN12-5,N,Tape B
JHMU,John Hancock Dynamic Municipal Bond ETF,TXN11-3,N,Tape B
JHPI,John Hancock Preferred Income ETF,TXN11-4,N,Tape B
JHS,John Hancock Income Securities Trust Capital Stock,TXN5-8,Y,Tape A
JHSC,John Hancock Multifactor Small Cap ETF,TXN10-5,N,Tape B
JHX,JAMES HARDIE INDUSTRIES plc.,TXN9-8,Y,Tape A
JIG,JPMorgan International Growth ETF,TXN12-4,N,Tape B
JIII,Janus Henderson Income ETF,TXN12-3,N,Tape B
JILL,"J.Jill, Inc. Common Stock",TXN7-8,Y,Tape A
JIRE,JPMorgan International Research Enhanced Equity ETF,TXN11-8,N,Tape B
JIVE,JPMorgan International Value ETF,TXN13-4,N,Tape C
JJSF,J&J Snack Foods Corp,TXN14-5,N,Tape C
JKHY,Henry (Jack) & Associates,TXN14-8,N,Tape C
JKS,JINKOSOLAR HOLDINGS CO,TXN2-5,Y,Tape A
JL,J-Long Group Limited Ordinary Shares,TXN13-5,N,Tape C
JLL,"Jones Lang LaSalle, Inc.",TXN7-8,Y,Tape A
JLQD,Janus Henderson Corporate Bond ETF,TXN11-2,N,Tape B
JLS,Nuveen Mortgage and Income Fund,TXN7-8,Y,Tape A
JMBS,Janus Henderson Mortgage-Backed Securities ETF,TXN10-1,N,Tape B
JMEE,JPMorgan Small & Mid Cap Enhanced Equity ETF,TXN12-4,N,Tape B
JMHI,JPMorgan High Yield Municipal ETF,TXN11-5,N,Tape B
JMIA,Jumia Technologies AG,TXN4-5,Y,Tape A
JMID,Janus Henderson Mid Cap Growth Alpha ETF,TXN14-6,N,Tape C
JMM,"NUVEEN MULTI-MARKET INCOME FUND, INC",TXN3-8,Y,Tape A
JMOM,JPMorgan U.S. Momentum Factor ETF,TXN12-3,N,Tape B
JMSB,"John Marshall Bancorp, Inc. Common Stock",TXN13-6,N,Tape C
JMSI,JPMorgan Sustainable Municipal Income ETF,TXN10-8,N,Tape B
JMST,JPMorgan Ultra-Short Municipal Income ETF,TXN11-4,N,Tape B
JMUB,JPMorgan Municipal ETF,TXN10-5,N,Tape B
JNEU,AllianzIM U.S. Equity Buffer15 Uncapped June ETF,TXN12-7,N,Tape B
JNJ,Johnson & Johnson,TXN6-7,Y,Tape A
JNK,SPDR Bloomberg High Yield Bond ETF,TXN12-7,N,Tape B
JNPR,Juniper Networks Inc,TXN5-1,Y,Tape A
JNUG,Direxion Daily Junior Gold Miners Index Bull 2X Shares,TXN12-2,N,Tape B
JNVR,Janover Inc. Common Stock,TXN14-4,N,Tape C
JOB,GEE Group Inc.,TXN10-3,N,Tape B
JOBY,"Joby Aviation, Inc.",TXN7-8,Y,Tape A
JOBY WS,"Joby Aviation, Inc.  Redeemable Warrants, each whole warrant exercisable for one share of Common Sto",TXN9-8,Y,Tape A
JOE,St. Joe Company,TXN8-7,Y,Tape A
JOET,Virtus Terranova U.S. Quality Momentum ETF,TXN11-5,N,Tape B
JOF,JAPAN SMALLER CAPITALIZATION FUND,TXN2-8,Y,Tape A
JOJO,ATAC Credit Rotation ETF,TXN12-1,N,Tape B
JOUT,Johnson Outdoors Inc,TXN14-3,N,Tape C
JPAN,Matthews Japan Active ETF,TXN12-8,N,Tape B
JPC,Nuveen Preferred & Income Opportunities Fund,TXN8-8,Y,Tape A
JPEF,JPMorgan Equity Focus ETF,TXN14-2,N,Tape C
JPEM,JPMorgan Diversified Return Emerging Markets Equity ETF,TXN12-5,N,Tape B
JPI,Nuveen Preferred Securities & Income Opportunities Fund,TXN5-8,Y,Tape A
JPIB,JPMorgan International Bond Opportunities ETF,TXN12-5,N,Tape B
JPIE,JPMorgan Income ETF,TXN10-3,N,Tape B
JPIN,JPMorgan Diversified Return International Equity ETF,TXN10-4,N,Tape B
JPLD,JPMorgan Limited Duration Bond ETF,TXN11-8,N,Tape B
JPM,JPMorgan Chase & Co.,TXN9-4,Y,Tape A
JPM PRC,"JPMorgan Chase & Co. Depositary Shares, each representing a 1/400th interest in a share of 6.00% Non",TXN2-8,Y,Tape A
JPM PRD,"JPMorgan Chase & Co. Depositary Shares, each representing a 1/400th  interest in a share of 5.75% No",TXN2-8,Y,Tape A
JPM PRJ,"JPMorgan Chase & Co. Depositary Shares, each representing a 1/400th interest in a share of JPMorgan ",TXN8-8,Y,Tape A
JPM PRK,"JPMorgan Chase & Co. Depositary Shares, each representing a 1/400th interest in a share of 4.55% Non",TXN6-8,Y,Tape A
JPM PRL,"JPMorgan Chase & Co. Depositary Shares, each representing a 1/400th interest in a share of 4.625% No",TXN1-8,Y,Tape A
JPM PRM,"JPMorgan Chase & Co. Depositary Shares, each representing a 1/400th interest in a share of 4.20% Non",TXN2-8,Y,Tape A
JPMB,JPMorgan USD Emerging Markets Sovereign Bond ETF,TXN11-4,N,Tape B
