QDIV,Global X S&P 500 Quality Dividend ETF,TXN10-2,N,Tape B
QDPL,Pacer Metaurus US Large Cap Dividend Multiplier 400 ETF,TXN10-5,N,Tape B
QDTE,Roundhill Innovation-100 0DTE Covered Call Strategy ETF,TXN12-4,N,Tape B
QDVO,Amplify CWP Growth & Income ETF,TXN12-8,N,Tape B
QEFA,SPDR MSCI EAFE StrategicFactors ETF,TXN10-2,N,Tape B
QEMM,SPDR MSCI Emerging Markets StrategicFactors ETF,TXN12-5,N,Tape B
QETA,Quetta Acquisition Corporation Common Stock,TXN14-8,N,Tape C
QETAR,Quetta Acquisition Corporation Right,TXN13-1,N,Tape C
QETAU,Quetta Acquisition Corporation Unit,TXN13-5,N,Tape C
QETH,Invesco Galaxy Ethereum ETF,TXN10-6,N,Tape B
QFIN,"Qifu Technology, Inc. American Depositary Shares",TXN14-1,N,Tape C
QFLR,Innovator Nasdaq-100 Managed Floor ETF,TXN10-7,N,Tape B
QGEN,QIAGEN N.V.,TXN9-3,Y,Tape A
QGRO,American Century U.S. Quality Growth ETF,TXN10-5,N,Tape B
QGRW,WisdomTree U.S. Quality Growth Fund,TXN11-5,N,Tape B
QH,Quhuo Limited American Depository Shares,TXN13-4,N,Tape C
QHDG,Innovator Hedged Nasdaq-100 ETF,TXN14-4,N,Tape C
QHY,WisdomTree U.S. High Yield Corporate Bond Fund,TXN12-1,N,Tape B
QID,ProShares UltraShort QQQ,TXN11-3,N,Tape B
QIG,WisdomTree U.S. Corporate Bond Fund,TXN12-4,N,Tape B
QINT,American Century Quality Diversified International ETF,TXN12-3,N,Tape B
QIPT,Quipt Home Medical Corp. Ordinary Shares,TXN13-2,N,Tape C
QIS,Simplify Multi-QIS Alternative ETF,TXN11-6,N,Tape B
QJUN,FT Vest Growth-100 Buffer ETF - June,TXN11-6,N,Tape B
QLC,FlexShares US Quality Large Cap Index Fund,TXN11-5,N,Tape B
QLD,ProShares Ultra QQQ,TXN10-5,N,Tape B
QLGN,"Qualigen Therapeutics, Inc. Common Stock",TXN14-6,N,Tape C
QLTA,iShares Aaa - A Rated Corporate Bond ETF,TXN12-1,N,Tape B
QLTI,GMO International Quality ETF,TXN10-2,N,Tape B
QLTY,GMO U.S. Quality ETF,TXN11-7,N,Tape B
QLV,FlexShares US Quality Low Volatility Index Fund,TXN12-6,N,Tape B
QLVD,FlexShares Developed Markets ex-US Quality Low Volatility Index Fund,TXN11-6,N,Tape B
QLVE,FlexShares Emerging Markets Quality Low Volatility Index Fund,TXN11-8,N,Tape B
QLYS,"Qualys, Inc. Common Stock",TXN14-8,N,Tape C
QMAG,FT Vest Nasdaq-100 Moderate Buffer ETF - August,TXN11-7,N,Tape B
QMAR,FT Vest Growth-100 Buffer ETF - March,TXN11-5,N,Tape B
QMCO,Quantum Corporation,TXN13-4,N,Tape C
QMID,WisdomTree U.S. MidCap Quality Growth Fund,TXN13-5,N,Tape C
QMMM,QMMM Holdings Limited Ordinary Shares,TXN13-5,N,Tape C
QMMY,FT Vest Nasdaq-100 Moderate Buffer ETF - May,TXN11-3,N,Tape B
QMNV,FT Vest Nasdaq-100 Moderate Buffer ETF - November,TXN12-7,N,Tape B
QMOM,Alpha Architect U.S. Quantitative Momentum ETF,TXN13-8,N,Tape C
QNCX,"Quince Therapeutics, Inc. Common Stock",TXN13-4,N,Tape C
QNRX,"Quoin Pharmaceuticals, Ltd. American Depositary Shares",TXN13-7,N,Tape C
QNST,"QuinStreet, Inc.",TXN13-7,N,Tape C
QNTM,Quantum Biopharma Ltd. Class B Subordinate Voting Shares,TXN14-5,N,Tape C
QNXT,iShares Nasdaq-100 ex Top 30 ETF,TXN14-7,N,Tape C
QOMO,Qomolangma Acquisition Corp. Common Stock,TXN13-6,N,Tape C
QOMOR,Qomolangma Acquisition Corp. Right,TXN14-5,N,Tape C
QOMOU,Qomolangma Acquisition Corp. Unit,TXN14-4,N,Tape C
QOMOW,Qomolangma Acquisition Corp. Warrant,TXN14-3,N,Tape C
QOWZ,Invesco Nasdaq Free Cash Flow Achievers ETF,TXN14-5,N,Tape C
QPFF,American Century Quality Preferred ETF,TXN10-8,N,Tape B
QPX,AdvisorShares Q Dynamic Growth ETF,TXN11-6,N,Tape B
QQA,Invesco QQQ Income Advantage ETF,TXN13-7,N,Tape C
QQEW,First Trust NASDAQ-100 Equal Weighted Index Fund,TXN13-5,N,Tape C
QQH,HCM Defender 100 Index ETF,TXN11-5,N,Tape B
QQJG,Invesco ESG NASDAQ Next Gen 100 ETF,TXN14-4,N,Tape C
QQMG,Invesco ESG NASDAQ 100 ETF,TXN13-6,N,Tape C
QQQ,"Invesco QQQ Trust, Series 1",TXN14-2,N,Tape C
QQQA,ProShares Nasdaq-100 Dorsey Wright Momentum ETF,TXN13-2,N,Tape C
QQQD,Direxion Daily Magnificent 7 Bear 1X Shares,TXN10-5,N,Tape B
QQQE,Direxion NASDAQ-100 Equal Weighted Index Shares,TXN13-7,N,Tape C
QQQG,Pacer Nasdaq 100 Top 50 Cash Cows Growth Leaders ETF,TXN14-5,N,Tape C
QQQI,NEOS Nasdaq 100 High Income ETF,TXN14-7,N,Tape C
QQQJ,Invesco NASDAQ Next Gen 100 ETF,TXN14-6,N,Tape C
QQQM,Invesco NASDAQ 100 ETF,TXN13-5,N,Tape C
QQQP,Tradr 2X Long Triple Q Quarterly ETF,TXN14-2,N,Tape C
QQQS,Invesco NASDAQ Future Gen 200 ETF,TXN14-2,N,Tape C
QQQT,Defiance Nasdaq 100 Income Target ETF,TXN13-1,N,Tape C
QQQU,Direxion Daily Magnificent 7 Bull 2X Shares,TXN12-2,N,Tape B
QQQW,Tradr 2X Long Triple Q Weekly ETF,TXN13-2,N,Tape C
QQQX,Nuveen NASDAQ 100 Dynamic Overwrite Fund - Shares of Beneficial Interest,TXN14-2,N,Tape C
QQQY,Tidal Trust II Defiance Nasdaq 100 Enhanced Options & 0DTE Income ETF,TXN14-6,N,Tape C
QQXT,First Trust NASDAQ - 100 Ex-Technology Sector Index Fund,TXN13-7,N,Tape C
QRFT,Qraft AI-Enhanced US Large Cap ETF,TXN10-7,N,Tape B
QRHC,Quest Resource Holding Corporation,TXN14-6,N,Tape C
QRMI,Global X NASDAQ 100 Risk Managed Income ETF,TXN13-4,N,Tape C
QRTEA,"Qurate Retail, Inc. Series A Common Stock",TXN14-6,N,Tape C
QRTEB,"Qurate Retail, Inc. Series B Common Stock",TXN13-4,N,Tape C
QRTEP,"Qurate Retail, Inc. 8.0% Fixed Rate Cumulative Redeemable Preferred Stock",TXN13-8,N,Tape C
QRVO,"Qorvo, Inc.",TXN14-1,N,Tape C
QS,QuantumScape Corporation,TXN3-5,Y,Tape A
QSG,QuantaSing Group Limited American Depositary Shares,TXN13-3,N,Tape C
QSI,Quantum-Si Incorporated Class A Common Stock,TXN13-7,N,Tape C
QSIAW,Quantum-Si Incorporated Warrant,TXN13-7,N,Tape C
QSIG,WisdomTree U.S. Short Term Corporate Bond Fund,TXN12-1,N,Tape B
QSIX,Pacer Metaurus Nasdaq 100 Dividend Multiplier 600 ETF,TXN14-1,N,Tape C
QSML,WisdomTree U.S. SmallCap Quality Growth Fund,TXN14-6,N,Tape C
QSPT,FT Vest Nasdaq-100 Buffer ETF - September,TXN10-5,N,Tape B
QSR,Restaurant Brands International Inc.,TXN9-7,Y,Tape A
QSWN,Amplify BlackSwan Tech & Treasury ETF,TXN10-8,N,Tape B
QTAP,Innovator Growth Accelerated Plus ETF - April,TXN11-5,N,Tape B
QTEC,First Trust NASDAQ-100 Technology  Index Fund,TXN14-3,N,Tape C
QTI,"QT Imaging Holdings, Inc. Common Stock",TXN14-7,N,Tape C
QTJA,Innovator Growth Accelerated Plus ETF - January,TXN12-8,N,Tape B
QTJL,Innovator Growth Accelerated Plus ETF - July,TXN10-4,N,Tape B
QTOC,Innovator Growth Accelerated Plus ETF - October,TXN11-7,N,Tape B
QTOP,iShares Nasdaq Top 30 Stocks ETF,TXN13-7,N,Tape C
QTR,Global X NASDAQ 100 Tail Risk ETF,TXN14-8,N,Tape C
QTRX,Quanterix Corporation Common Stock,TXN13-3,N,Tape C
QTTB,Q32 Bio Inc. Common Stock,TXN14-8,N,Tape C
QTUM,Defiance Quantum ETF,TXN13-8,N,Tape C
QTWO,Q2 Holdings Inc,TXN7-6,Y,Tape A
QUAD,"QUAD/GRAPHICS, INC.",TXN7-8,Y,Tape A
QUAL,iShares MSCI USA Quality Factor ETF,TXN11-8,N,Tape B
QUBT,Quantum Computing Inc. Common,TXN13-6,N,Tape C
QUIK,QuickLogic Corp,TXN13-2,N,Tape C
QULL,ETRACS 2x Leveraged MSCI US Quality Factor TR ETN,TXN12-8,N,Tape B
QURE,uniQure N.V.,TXN14-6,N,Tape C
QUS,SPDR MSCI USA StrategicFactors ETF,TXN10-1,N,Tape B
QUVU,Hartford Quality Value ETF,TXN11-5,N,Tape B
QVAL,Alpha Architect U.S. Quantitative Value ETF,TXN14-3,N,Tape C
QVCC,"QVC, Inc. 6.250% Senior Secured Notes due 2068",TXN3-8,Y,Tape A
QVCD,"QVC, Inc. 6.375% Senior Secured Notes due 2067",TXN4-8,Y,Tape A
QVML,Invesco S&P 500 QVM Multi-factor ETF,TXN11-4,N,Tape B
QVMM,Invesco S&P MidCap 400 QVM Multi-factor ETF,TXN10-6,N,Tape B
QVMS,Invesco S&P SmallCap 600 QVM Multi-factor ETF,TXN10-5,N,Tape B
QVOY,Q3 All-Season Active Rotation ETF,TXN10-6,N,Tape B
QWLD,SPDR MSCI World StrategicFactors ETF,TXN12-2,N,Tape B
QXO,"QXO, Inc. Common Stock",TXN14-5,N,Tape C
QXQ,SGI Enhanced Nasdaq-100 ETF,TXN14-1,N,Tape C
QYLD,Global X Funds Global X NASDAQ-100 Covered Call ETF,TXN14-8,N,Tape C
QYLE,Global X Nasdaq 100 ESG Covered Call ETF,TXN13-2,N,Tape C
QYLG,Global X Nasdaq 100 Covered Call & Growth ETF,TXN14-6,N,Tape C
R,"Ryder System, Inc.",TXN1-8,Y,Tape A
RA,Brookfield Real Assets Income Fund Inc.,TXN8-6,Y,Tape A
RAAX,VanEck Inflation Allocation ETF,TXN12-6,N,Tape B
RACE,Ferrari N.V.,TXN9-7,Y,Tape A
RAFE,PIMCO RAFI ESG U.S. ETF,TXN10-1,N,Tape B
RAIL,"FreightCar America, Inc.",TXN13-4,N,Tape C
RAMP,"LiveRamp Holdings, Inc. Common Stock",TXN9-4,Y,Tape A
RAND,Rand Capital Corp,TXN14-2,N,Tape C
RANI,"Rani Therapeutics Holdings, Inc. Class A Common Stock",TXN14-5,N,Tape C
RAPP,"Rapport Therapeutics, Inc. Common Stock",TXN13-6,N,Tape C
RAPT,"RAPT Therapeutics, Inc. Common Stock",TXN14-8,N,Tape C
RARE,Ultragenyx Pharmaceutical Inc.,TXN13-5,N,Tape C
RATE,Global X Interest Rate Hedge ETF,TXN11-1,N,Tape B
RAVE,"Rave Restaurant Group, Inc.",TXN14-1,N,Tape C
RAVI,FlexShares Ultra-Short Income Fund,TXN11-8,N,Tape B
RAY,Raytech Holding Limited Ordinary Shares,TXN14-5,N,Tape C
RAYA,Erayak Power Solution Group Inc. Class A Ordinary Shares,TXN14-7,N,Tape C
RAYC,Rayliant Quantamental China Equity ETF,TXN12-4,N,Tape B
RAYD,Rayliant Quantitative Developed Market Equity ETF,TXN11-4,N,Tape B
RAYE,Rayliant Quantamental Emerging Market ex-China Equity ETF,TXN12-2,N,Tape B
RAYJ,Rayliant SMDAM Japan Equity ETF,TXN10-7,N,Tape B
RAYS,Global X Solar ETF,TXN14-5,N,Tape C
RBA,"RB Global, Inc.",TXN3-7,Y,Tape A
RBB,RBB Bancorp Common Stock,TXN14-6,N,Tape C
RBBN,Ribbon Communications Inc. Common Stock,TXN13-5,N,Tape C
RBC,RBC Bearings Incorporated,TXN4-8,Y,Tape A
RBCAA,Republic Bancorp Inc/KY,TXN14-6,N,Tape C
RBKB,"Rhinebeck Bancorp, Inc. Common Stock",TXN14-7,N,Tape C
RBLD,First Trust Alerian US NextGen Infrastructure ETF,TXN11-4,N,Tape B
RBLX,Roblox Corporation,TXN4-1,Y,Tape A
RBOT,Vicarious Surgical Inc.,TXN5-8,Y,Tape A
RBOT WS,"Vicarious Surgical Inc. Warrants, each whole warrant exercisable for 1/30th of a share of Class A Co",TXN7-8,Y,Tape A
RBRK,"Rubrik, Inc.",TXN3-6,Y,Tape A
RBUF,Innovator U.S. Small Cap 10 Buffer ETF - Quarterly,TXN11-1,N,Tape B
RC,Ready Capital Corporation,TXN9-2,Y,Tape A
RC PRC,Ready Capital Corporation 6.25% Series C Cumulative Convertible Preferred Stock,TXN6-8,Y,Tape A
RC PRE,Ready Capital Corporation 6.50% Series E Cumulative Redeemable Preferred Stock,TXN6-8,Y,Tape A
RCAT,"Red Cat Holdings, Inc. Common Stock",TXN14-7,N,Tape C
RCB,Ready Capital Corporation 6.20% Senior Notes due 2026,TXN7-8,Y,Tape A
RCC,Ready Capital Corporation 5.75% Senior Notes due 2026,TXN5-8,Y,Tape A
RCEL,"Avita Medical, Inc. Common Stock",TXN14-6,N,Tape C
RCG,RENN Fund Inc.,TXN12-7,N,Tape B
RCI,"Rogers Communications, Inc.",TXN6-4,Y,Tape A
RCKT,"Rocket Pharmaceuticals, Inc. Common Stock",TXN14-4,N,Tape C
RCKTW,"Rocket Pharmaceuticals, Inc. Warrant",TXN14-8,N,Tape C
RCKY,"Rocky Brands, Inc.",TXN14-5,N,Tape C
RCL,Royal Caribbean Group,TXN9-3,Y,Tape A
RCMT,RCM Technologies Inc,TXN14-8,N,Tape C
RCON,"Recon Technology, Ltd. Class A Ordinary Shares",TXN13-2,N,Tape C
RCS,"PIMCO STRATEGIC INCOME FUND, INC.",TXN3-8,Y,Tape A
RCUS,"Arcus Biosciences, Inc.",TXN1-8,Y,Tape A
RDACU,Rising Dragon Acquisition Corp. Unit,TXN14-5,N,Tape C
RDCM,Radcom Ltd.,TXN13-8,N,Tape C
RDDT,"Reddit, Inc.",TXN7-3,Y,Tape A
RDFI,Rareview Dynamic Fixed Income ETF,TXN12-8,N,Tape B
RDFN,Redfin Corporation Common Stock,TXN14-3,N,Tape C
RDHL,Redhill Biopharma Ltd.,TXN13-8,N,Tape C
RDI,"Reading International, Inc Class A Common Stock",TXN14-4,N,Tape C
RDIB,"Reading International, Inc (Class B",TXN13-4,N,Tape C
RDIV,Invesco S&P Ultra Dividend Revenue ETF,TXN10-6,N,Tape B
RDN,Radian Group Inc.,TXN3-8,Y,Tape A
RDNT,"RadNet, Inc. Common Stock",TXN13-7,N,Tape C
RDOG,ALPS REIT Dividend Dogs ETF,TXN10-5,N,Tape B
RDTE,Roundhill Small Cap 0DTE Covered Call Strategy ETF,TXN10-2,N,Tape B
RDUS,"Radius Recycling, Inc. Class A Common Stock",TXN13-5,N,Tape C
RDVI,FT Vest Rising Dividend Achievers Target Income ETF,TXN10-3,N,Tape B
RDVT,"Red Violet, Inc. Common Stock",TXN14-2,N,Tape C
RDVY,First Trust Rising Dividend Achievers ETF,TXN13-5,N,Tape C
RDW,Redwire Corporation,TXN1-8,Y,Tape A
RDW WS,"Redwire Corporation Redeemable Warrants, each whole warrant exercisable for one share of Common Stoc",TXN7-8,Y,Tape A
RDWR,Radware Ltd.,TXN14-1,N,Tape C
RDY,Dr. Reddy's Laboratories Limited American Depositary Shares,TXN1-5,Y,Tape A
RDZN,"Roadzen, Inc. Ordinary Shares",TXN13-3,N,Tape C
RDZNW,"Roadzen, Inc. Warrants",TXN13-2,N,Tape C
REAI,Tidal ETF Trust Intelligent Real Estate ETF,TXN14-6,N,Tape C
REAL,"The RealReal, Inc. Common Stock",TXN13-4,N,Tape C
REAX,REAL BROKERAGE INC,TXN13-4,N,Tape C
REBN,"Reborn Coffee, Inc. Common Stock",TXN13-1,N,Tape C
RECS,Columbia Research Enhanced Core ETF,TXN11-6,N,Tape B
RECT,Rectitude Holdings Ltd Ordinary Shares,TXN13-8,N,Tape C
REE,REE Automotive Ltd. Class A Ordinary Shares,TXN13-8,N,Tape C
REET,iShares Global REIT ETF,TXN11-8,N,Tape B
REFI,"Chicago Atlantic Real Estate Finance, Inc. Common Stock",TXN14-5,N,Tape C
REFR,Research Frontiers Inc,TXN13-1,N,Tape C
REG,Regency Centers Corporation,TXN14-1,N,Tape C
REGCO,Regency Centers Corporation 5.875% Series B Cumulative Redeemable Preferred Stock,TXN14-2,N,Tape C
REGCP,Regency Centers Corporation 6.25% Series A Cumulative Redeemable Preferred Stock,TXN13-5,N,Tape C
REGL,ProShares S&P MidCap 400 Dividend Aristocrats ETF,TXN11-3,N,Tape B
REGN,Regeneron Pharmaceuticals Inc,TXN13-6,N,Tape C
REI,Ring Energy Inc.,TXN10-5,N,Tape B
REIT,ALPS Active REIT ETF,TXN14-5,N,Tape C
REK,ProShares Short Real Estate,TXN10-5,N,Tape B
REKR,"Rekor Systems, Inc. Common Stock",TXN13-8,N,Tape C
REKT,Direxion Daily Crypto Industry Bear 1X Shares,TXN10-5,N,Tape B
RELI,"Reliance Global Group, Inc. Common Stock",TXN14-4,N,Tape C
RELIW,"Reliance Global Group, Inc. Series A Warrants",TXN13-8,N,Tape C
RELL,Richardson Electronics Ltd,TXN13-8,N,Tape C
RELX,RELX PLC,TXN6-4,Y,Tape A
RELY,"Remitly Global, Inc. Common Stock",TXN14-4,N,Tape C
REM,iShares Mortgage Real Estate ETF,TXN10-5,N,Tape B
REMX,VanEck Rare Earth and Strategic Metals ETF,TXN11-8,N,Tape B
RENB,Renovaro Inc. Common Stock,TXN14-8,N,Tape C
RENE,Cartesian Growth Corporation II Class A Ordinary Shares,TXN14-1,N,Tape C
RENEU,Cartesian Growth Corporation II Unit,TXN14-8,N,Tape C
RENEW,Cartesian Growth Corporation II Warrant,TXN14-2,N,Tape C
RENT,"Rent the Runway, Inc. Class A Common Stock",TXN13-3,N,Tape C
RENW,Harbor Energy Transition Strategy ETF,TXN12-5,N,Tape B
REPL,"Replimune Group, Inc.",TXN14-5,N,Tape C
REPX,"Riley Exploration Permian, Inc.",TXN10-3,N,Tape B
RERE,ATRenew Inc. American Depositary Shares (every three of which representing two Class A ordinary shar,TXN1-7,Y,Tape A
RES,"RPC, Inc.",TXN3-5,Y,Tape A
RETL,Direxion Daily Retail Bull 3X Shares,TXN10-1,N,Tape B
RETO,"ReTo Eco-Solutions, Inc. Class A Shares",TXN13-5,N,Tape C
REVB,"Revelation Biosciences, Inc. Common Stock",TXN13-8,N,Tape C
REVBW,"Revelation Biosciences, Inc. Warrant",TXN14-6,N,Tape C
REVG,"REV Group, Inc.",TXN6-6,Y,Tape A
REVS,Columbia Research Enhanced Value ETF,TXN12-3,N,Tape B
REW,Proshares UltraShort Technology,TXN10-4,N,Tape B
REX,REX American Resources Corp.,TXN6-8,Y,Tape A
REXR,"REXFORD INDUSTRIAL REALTY, INC.",TXN8-1,Y,Tape A
REXR PRB,"Rexford Industrial Realty, Inc. 5.875% Series B Cumulative Redeemable Preferred Stock",TXN4-8,Y,Tape A
REXR PRC,"Rexford Industrial Realty, Inc. 5.625% Series C Cumulative Redeemable Preferred Stock, par value $0.",TXN4-8,Y,Tape A
REYN,Reynolds Consumer Products Inc. Common Stock,TXN13-6,N,Tape C
REZ,iShares Residential and Multisector Real Estate ETF,TXN10-5,N,Tape B
REZI,"Resideo Technologies, Inc. Common Stock",TXN3-4,Y,Tape A
RF,Regions Financial Corp.,TXN3-3,Y,Tape A
RF PRC,"Regions Financial Corporation Depositary Shares, each Representing a 1/40th Interest in a Share of 5",TXN9-8,Y,Tape A
RF PRE,"Regions Financial Corporation Depositary Shares, Each Representing a 1/40th Interest in a Share of 4",TXN7-8,Y,Tape A
RF PRF,Regions Financial Corporation Depositary Shares Each Representing a 1/40th Interest in a Share of No,TXN2-8,Y,Tape A
RFAC,RF Acquisition Corp. Class A Common Stock,TXN13-4,N,Tape C
RFACR,RF Acquisition Corp. Rights,TXN14-4,N,Tape C
RFACU,RF Acquisition Corp. Unit,TXN13-8,N,Tape C
RFACW,RF Acquisition Corp. Warrants,TXN14-5,N,Tape C
RFAI,RF Acquisition Corp II Ordinary Shares,TXN13-7,N,Tape C
RFAIR,RF Acquisition Corp II Right,TXN13-7,N,Tape C
RFAIU,RF Acquisition Corp II Unit,TXN14-2,N,Tape C
RFCI,RiverFront Dynamic Core Income,TXN10-2,N,Tape B
RFDA,RiverFront Dynamic US Dividend Advantage ETF,TXN10-1,N,Tape B
RFDI,First Trust RiverFront Dynamic Developed International ETF,TXN14-7,N,Tape C
RFEM,First Trust RiverFront Dynamic Emerging Markets ETF,TXN13-4,N,Tape C
RFEU,First Trust RiverFront Dynamic Europe ETF,TXN13-2,N,Tape C
RFFC,ALPS Active Equity Opportunity ETF,TXN12-8,N,Tape B
RFG,Invesco S&P MidCap 400 Pure Growth ETF,TXN11-4,N,Tape B
RFI,Cohen and Steers Total Return Realty Fund,TXN3-8,Y,Tape A
RFIL,RF Industries Ltd,TXN13-7,N,Tape C
RFL,"Rafael Holdings, Inc. Class B Common Stock",TXN5-8,Y,Tape A
RFLR,Innovator U.S. Small Cap Managed Floor ETF,TXN10-3,N,Tape B
RFM,"RiverNorth Flexible Municipal Income Fund, Inc.",TXN1-8,Y,Tape A
RFMZ,"RiverNorth Flexible Municipal Income Fund II, Inc.",TXN9-8,Y,Tape A
RFV,Invesco S&P MidCap 400 Pure Value ETF,TXN12-3,N,Tape B
RGA,"Reinsurance Group of America, Incorporated",TXN9-8,Y,Tape A
RGC,Regencell Bioscience Holdings Limited Ordinary Shares,TXN13-1,N,Tape C
RGCO,RGC Resources Inc,TXN13-2,N,Tape C
RGEF,Rockefeller Global Equity ETF,TXN10-5,N,Tape B
RGEN,Repligen Corp,TXN13-6,N,Tape C
RGF,"The Real Good Food Company, Inc. Class A Common Stock",TXN14-7,N,Tape C
RGLD,Royal Gold Inc,TXN14-3,N,Tape C
RGLS,Regulus Therapeutics Inc.,TXN13-5,N,Tape C
RGNX,REGENXBIO Inc.,TXN14-7,N,Tape C
RGP,Resources Connection,TXN14-4,N,Tape C
RGR,"Sturm, Ruger & Company, Inc.",TXN2-8,Y,Tape A
RGS,Regis Corporation,TXN14-3,N,Tape C
RGT,"Royce Global Trust, Inc.",TXN2-8,Y,Tape A
RGTI,"Rigetti Computing, Inc. Common Stock",TXN14-7,N,Tape C
RGTIW,"Rigetti Computing, Inc. Warrants",TXN13-8,N,Tape C
RH,RH,TXN5-7,Y,Tape A
RHCB,BNY Mellon Responsible Horizons Corporate Bond ETF,TXN10-4,N,Tape B
RHE,"Regional Health Properties, Inc.",TXN12-8,N,Tape B
RHE PRA,"Regional Health Properties, Inc. Regional Health Properties, Inc. 10.875 percent Series A Cumulative",TXN11-2,N,Tape B
RHI,Robert Half Inc.,TXN6-7,Y,Tape A
RHP,"Ryman Hospitality Properties, Inc",TXN4-6,Y,Tape A
RHRX,RH Tactical Rotation ETF,TXN12-1,N,Tape B
RHTX,RH Tactical Outlook ETF,TXN12-1,N,Tape B
RICK,"RCI Hospitality Holdings, Inc.",TXN13-1,N,Tape C
RIET,Hoya Capital High Dividend Yield ETF,TXN12-1,N,Tape B
RIG,Transocean LTD.,TXN4-8,Y,Tape A
RIGL,Rigel Pharmaceuticals Inc. (New),TXN13-7,N,Tape C
RIGS,RiverFront Strategic Income Fund,TXN11-1,N,Tape B
RILY,"B. RILEY FINANCIAL, INC.",TXN13-6,N,Tape C
RILYG,"B. Riley Financial, Inc. 5.00% Senior Notes due 2026",TXN14-2,N,Tape C
RILYK,"B. Riley Financial, Inc. 5.50% Senior Notes Due 2026",TXN13-2,N,Tape C
RILYL,"B. Riley Financial, Inc. Depositary Shares each representing 1/1000th in a share of 7.375% Series B ",TXN14-7,N,Tape C
RILYM,"B. Riley Financial, Inc. 6.375% Senior Notes due 2025",TXN14-7,N,Tape C
RILYN,"B. Riley Financial, Inc. 6.50% Senior Notes Due 2026",TXN13-6,N,Tape C
RILYP,"B. Riley Financial, Inc. Depositary Shares, each representing a 1/1000th fractional interest in a sh",TXN14-4,N,Tape C
RILYT,"B. Riley Financial, Inc. 6.00% Senior Notes Due 2028",TXN13-7,N,Tape C
RILYZ,"B. Riley Financial, Inc. 5.25% Senior Notes due 2028",TXN14-5,N,Tape C
RIME,"Algorhythm Holdings, Inc. Common Stock",TXN13-6,N,Tape C
RINC,AXS Real Estate Income ETF,TXN11-6,N,Tape B
RINF,ProShares Inflation Expectations ETF,TXN10-1,N,Tape B
RING,iShares MSCI Global Gold Miners ETF,TXN13-2,N,Tape C
RIO,Rio Tinto plc,TXN2-4,Y,Tape A
RIOT,"Riot Platforms, Inc. Common Stock",TXN13-6,N,Tape C
RISN,Inspire Tactical Balanced ETF,TXN12-1,N,Tape B
RISR,FolioBeyond Alternative Income and Interest Rate Hedge ETF,TXN12-3,N,Tape B
RITA,ETFB Green SRI REITs ETF,TXN11-2,N,Tape B
RITM,Rithm Capital Corp.,TXN4-5,Y,Tape A
RITM PRA,Rithm Capital Corp.7.50% Series A Fixed-to-Floating Rate Cumulative Redeemable Preferred Stock,TXN4-8,Y,Tape A
RITM PRB,Rithm Capital Corp. 7.125% Series B Fixed-to-Floating Rate Cumulative Redeemable Preferred Stock,TXN1-8,Y,Tape A
RITM PRC,Rithm Capital Corp. 6.375% Series C Fixed-to-Floating Rate Cumulative Redeemable Preferred Stock,TXN2-8,Y,Tape A
RITM PRD,Rithm Capital Corp. 7.00% Fixed-Rate Reset Series D Cumulative Redeemable Preferred Stock,TXN9-8,Y,Tape A
RITR,Reitar Logtech Holdings Limited Ordinary shares,TXN14-7,N,Tape C
RIV,"RiverNorth Opportunities Fund, Inc. Common Stock",TXN5-8,Y,Tape A
RIV PRA,"RiverNorth Opportunities Fund, Inc. 6.00% Series A Perpetual Preferred Stock",TXN4-8,Y,Tape A
RIVN,"Rivian Automotive, Inc. Class A Common Stock",TXN13-1,N,Tape C
RJF,"Raymond James Financial, Inc.",TXN5-2,Y,Tape A
RJF PRB,"Raymond James Financial, Inc. Depositary Shares, each representing a 1/40th interest in a share of 6",TXN7-8,Y,Tape A
RJMG,FT Raymond James Multicap Growth Equity ETF,TXN11-2,N,Tape B
RKDA,"Arcadia Biosciences, Inc.",TXN14-2,N,Tape C
RKLB,"Rocket Lab USA, Inc. Common Stock",TXN14-4,N,Tape C
RKT,"Rocket Companies, Inc.",TXN9-7,Y,Tape A
RL,Ralph Lauren Corporation,TXN3-6,Y,Tape A
RLAY,"Relay Therapeutics, Inc. Common Stock",TXN13-3,N,Tape C
RLGT,"Radiant Logistics, Inc.",TXN10-4,N,Tape B
RLI,RLI Corp.,TXN2-8,Y,Tape A
RLJ,RLJ Lodging Trust,TXN9-7,Y,Tape A
RLJ PRA,RLJ Lodging Trust $1.95 Series A Cumulative Convertible Preferred Shares,TXN4-8,Y,Tape A
RLMD,"Relmada Therapeutics, Inc. Common Stock",TXN14-3,N,Tape C
RLTY,Cohen & Steers Real Estate Opportunities and Income Fund,TXN6-8,Y,Tape A
RLX,"RLX Technology Inc. American Depositary Shares, each representing the right to receive one (1) Class",TXN9-8,Y,Tape A
RLY,SPDR SSgA Multi-Asset Real Return ETF of SSgA Active Trust,TXN10-3,N,Tape B
RLYB,Rallybio Corporation Common Stock,TXN14-7,N,Tape C
RM,REGIONAL MANAGEMENT CORP,TXN3-8,Y,Tape A
RMAX,"RE/MAX HOLDINGS, INC.",TXN9-6,Y,Tape A
RMBI,"Richmond Mutual Bancorporation, Inc. Common Stock",TXN14-1,N,Tape C
RMBL,"RumbleOn, Inc. Class B Common Stock",TXN14-7,N,Tape C
RMBS,Rambus Inc,TXN14-3,N,Tape C
RMCA,Rockefeller California Municipal Bond ETF,TXN11-1,N,Tape B
RMCF,"Rocky Mountain Chocolate Factory, Inc. Common Stock",TXN13-4,N,Tape C
RMCO,Royalty Management Holding Corporation Class A Common Stock,TXN13-3,N,Tape C
RMCOW,Royalty Management Holding Corporation Warrant,TXN13-2,N,Tape C
RMD,ResMed Inc.,TXN1-4,Y,Tape A
RMI,"RiverNorth Opportunistic Municipal Income Fund, Inc. Common Stock",TXN8-8,Y,Tape A
RMIF,LHA Risk-Managed Income ETF,TXN10-5,N,Tape B
RMM,"RiverNorth Managed Duration Municipal Income Fund, Inc.",TXN7-8,Y,Tape A
RMMZ,"RiverNorth Managed Duration Municipal Income Fund II, Inc.",TXN6-8,Y,Tape A
RMNI,"Rimini Street, Inc. (DE) Common Stock",TXN14-5,N,Tape C
RMNY,Rockefeller New York Municipal Bond ETF,TXN11-4,N,Tape B
RMOP,Rockefeller Opportunistic Municipal Bond ETF,TXN11-7,N,Tape B
RMR,The RMR Group Inc. Class A Common Stock,TXN14-7,N,Tape C
RMSG,Real Messenger Corporation Ordinary Shares,TXN14-3,N,Tape C
RMSGW,Real Messenger Corporation Warrants,TXN14-2,N,Tape C
RMT,Royce Micro-Cap Trust Inc,TXN4-8,Y,Tape A
RMTI,"Rockwell Medical, Inc. (DE) Common Stock",TXN13-3,N,Tape C
RNA,"Avidity Biosciences, Inc. Common Stock",TXN13-8,N,Tape C
RNAC,"Cartesian Therapeutics, Inc. Common Stock",TXN14-4,N,Tape C
RNAZ,"TransCode Therapeutics, Inc. Common Stock",TXN13-8,N,Tape C
RND,First Trust Bloomberg R&D Leaders ETF,TXN11-1,N,Tape B
RNEM,First Trust Emerging Markets Equity Select ETF,TXN14-1,N,Tape C
RNEW,VanEck Green Infrastructure ETF,TXN13-7,N,Tape C
RNG,"RINGCENTRAL, INC.",TXN4-7,Y,Tape A
RNGR,"Ranger Energy Services, Inc.",TXN6-8,Y,Tape A
RNP,"Cohen & Steers REIT and Preferred and Income Fund, Inc.",TXN8-8,Y,Tape A
RNR,RenaissanceRe Holdings Ltd.,TXN6-7,Y,Tape A
RNR PRF,"RenaissanceRe Holdings Ltd. Depositary Shares, each Representing a 1/1,000th Interest in a 5.750% Se",TXN1-8,Y,Tape A
RNR PRG,"RenaissanceRe Holdings Ltd. Depositary Shares, each representing a 1/1, 000th interest in a share of",TXN6-8,Y,Tape A
RNRG,Global X Funds Global X Renewable Energy Producers ETF,TXN14-3,N,Tape C
RNSC,First Trust Small Cap US Equity Select ETF,TXN13-4,N,Tape C
RNST,Renasant Corporation,TXN4-8,Y,Tape A
RNW,ReNew Energy Global plc Class A Ordinary Shares,TXN13-4,N,Tape C
RNWWW,ReNew Energy Global plc Warrant,TXN13-3,N,Tape C
RNWZ,TrueShares Eagle Global Renewable Energy Income ETF,TXN12-3,N,Tape B
RNXT,"RenovoRx, Inc. Common Stock",TXN13-8,N,Tape C
ROAD,"Construction Partners, Inc. Class A Common Stock",TXN14-5,N,Tape C
ROAM,Hartford Multifactor Emerging Markets ETF,TXN10-1,N,Tape B
ROBO,ROBO Global Robotics & Automation Index ETF,TXN10-2,N,Tape B
ROBT,First Trust Nasdaq Artificial Intelligence and Robotics ETF,TXN13-7,N,Tape C
ROCK,"Gibraltar Industries, Inc.",TXN13-1,N,Tape C
ROCL,Roth CH Acquisition V Co. Common Stock,TXN14-1,N,Tape C
ROCLU,Roth CH Acquisition V Co. Unit,TXN13-6,N,Tape C
ROCLW,Roth CH Acquisition V Co. Warrant,TXN13-6,N,Tape C
RODE,Hartford Multifactor Diversified International ETF,TXN11-2,N,Tape B
RODM,Hartford Multifactor Developed Markets (ex-US) ETF,TXN10-4,N,Tape B
ROE,EA Series Trust Astoria US Equal Weight Quality Kings ETF,TXN13-3,N,Tape C
ROG,Rogers Corporation,TXN1-8,Y,Tape A
ROIC,Retail Opportunity Investments Corp.,TXN14-5,N,Tape C
ROIS,Hartford Multifactor International Small Company ETF,TXN12-1,N,Tape B
ROIV,Roivant Sciences Ltd. Common Shares,TXN14-4,N,Tape C
ROK,"Rockwell Automation, Inc.",TXN1-5,Y,Tape A
ROKT,SPDR S&P Kensho Final Frontiers ETF,TXN10-8,N,Tape B
ROKU,"Roku, Inc. Class A Common Stock",TXN13-1,N,Tape C
ROL,"Rollins, Inc.",TXN4-5,Y,Tape A
ROLR,"High Roller Technologies, Inc.",TXN10-3,N,Tape B
ROM,ProShares Ultra Technology,TXN10-6,N,Tape B
ROMA,Roma Green Finance Limited Ordinary Shares,TXN14-3,N,Tape C
ROMO,Strategy Shares Newfound/ReSolve Robust Momentum ETF,TXN12-4,N,Tape B
ROOT,"Root, Inc. Class A Common Stock",TXN14-8,N,Tape C
ROP,"Roper Technologies, Inc. Common Stock",TXN14-5,N,Tape C
RORO,ATAC US Rotation ETF,TXN12-1,N,Tape B
ROSC,Hartford Multifactor Small Cap ETF,TXN10-1,N,Tape B
ROST,Ross Stores Inc,TXN13-2,N,Tape C
ROUS,Hartford Multifactor US Equity ETF,TXN10-4,N,Tape B
RPAR,RPAR Risk Parity ETF,TXN11-3,N,Tape B
